estLocus,Nomen,Textus,URN,,,,,,,,,,,,,,,,,,,,,,
estlocus4,Achademia,"Nunc tibi quae placidas Achademia cessit habenas ,",crije02.croala292491.croala-lat2w:body.div6.div3.l7.w5,,,,,,,,,,,,,,,,,,,,,,
estlocus4,Achademiae,Atque Achademiae saucia turba gemit .,crije02.croala292491.croala-lat2w:body.div6.div3.l272.w2,,,,,,,,,,,,,,,,,,,,,,
estlocus4,Achademiae,"Sic Achademiae princeps censorque uocaris ,",crije02.croala292491.croala-lat2w:body.div6.div8.l41.w2,,,,,,,,,,,,,,,,,,,,,,
estlocus4,Acheloia,"Num si Trinacrias , Acheloia monstra , uolucres",crije02.croala292491.croala-lat2w:body.div2.div6.l104.w4,,,,,,,,,,,,,,,,,,,,,,
estlocus4,Acheloia,"Quando aliter tetras , Acheloia monstra , uolucres",crije02.croala292491.croala-lat2w:body.div2.div7.l14.w4,,,,,,,,,,,,,,,,,,,,,,
estlocus4,Acheloa,Acheloa monstra quali,crije02.croala292491.croala-lat2w:body.div7.div31.l7.w1,,,,,,,,,,,,,,,,,,,,,,
estlocus1,Acherontis,"Hostium uictrix , Acherontis horror ,",crije02.croala292491.croala-lat2w:body.div2.div3.l57.w3,,,,,,,,,,,,,,,,,,,,,,
estlocus1,Acheronta,Fictum Acheronta putas ? Furiarum uerbera rides ?,crije02.croala292491.croala-lat2w:body.div4.div10.l11.w2,,,,,,,,,,,,,,,,,,,,,,
estlocus2,Adriaci,"Parua uel Adriaci deuouet ora freti ,",crije02.croala292491.croala-lat2w:body.div1.div3.l36.w3,,,,,,,,,,,,,,,,,,,,,,
estlocus1,Adria,"Sed ne , interiectis tot molibus , Adria clausus",crije02.croala292491.croala-lat2w:body.div1.div20.l5.w6,,,,,,,,,,,,,,,,,,,,,,
estlocus2,Adriacas,"Adriacas tendat proximus horror aquas ,",crije02.croala292491.croala-lat2w:body.div1.div21.l2.w1,,,,,,,,,,,,,,,,,,,,,,
estlocus1,Adria,Lasciuire suis Adria gaudet aquis .,crije02.croala292491.croala-lat2w:body.div3.div1.l116.w3,,,,,,,,,,,,,,,,,,,,,,
estlocus1,Adria,"Quod neque spumosis Adria fecit aquis ,",crije02.croala292491.croala-lat2w:body.div3.div21.l8.w4,,,,,,,,,,,,,,,,,,,,,,
estlocus1,Adria,"Nanque reluctetur licet obuius Adria , mollem",crije02.croala292491.croala-lat2w:body.div4.div11.l7.w5,,,,,,,,,,,,,,,,,,,,,,
estlocus2,Adriaci,"Vrbs Venetum , Adriaci dominatrix maxima ponti ,",crije02.croala292491.croala-lat2w:body.div5.div4.l413.w3,,,,,,,,,,,,,,,,,,,,,,
estlocus1,Adriae,"Non brumam aut rabiem Adriae aestuantis ,",crije02.croala292491.croala-lat2w:body.div6.div38.l28.w5,,,,,,,,,,,,,,,,,,,,,,
estlocus0,Aeger,Aeger ut incassum felix intercute morbo,crije02.croala292491.croala-lat2w:body.div3.div2.l7.w1,,,,,,,,,,,,,,,,,,,,,,
estlocus4,Aegeas,Ergo uel Aegeas hyemes et saxa Capharei,crije02.croala292491.croala-lat2w:body.div3.div21.l3.w3,,,,,,,,,,,,,,,,,,,,,,
estlocus3,Aegypthusne,Aegypthusne canes et sua monstra daret ?,crije02.croala292491.croala-lat2w:body.div1.div5.l46.w1,,,,,,,,,,,,,,,,,,,,,,
estlocus3,Aethiopes,Aethiopes nigro tales perhibentur in aestu,crije02.croala292491.croala-lat2w:body.div3.div16.l27.w1,,,,,,,,,,,,,,,,,,,,,,
estlocus3,Aethiopas,Persequar exustos decolor Aethiopas ?,crije02.croala292491.croala-lat2w:body.div4.div16.l22.w4,,,,,,,,,,,,,,,,,,,,,,
estlocus3,Aethiopum,"Aethiopum conuiua Iouis , seu lumine fesso",crije02.croala292491.croala-lat2w:body.div5.div1.l47.w1,,,,,,,,,,,,,,,,,,,,,,
estlocus3,Aethiopum,"2 , 44 - 45 Assimulant . . . resoluunt inmargine : Humanas si quando dapes terrasque reuisunt / Aethiopum mediaque pares epulantur harena",crije02.croala292491.croala-lat2w:body.div5.div2.l45.note.w12,,,,,,,,,,,,,,,,,,,,,,
estlocus2,Aethnaeis,"Effugis , Aethnaeis scopulis saxoque Sicano",crije02.croala292491.croala-lat2w:body.div2.div7.l18.w2,,,,,,,,,,,,,,,,,,,,,,
estlocus3,Affrica,"Aut sua Scipiadae dedit Affrica , Creta Metello ,",crije02.croala292491.croala-lat2w:body.div3.div10.l7.w5,,,,,,,,,,,,,,,,,,,,,,
estlocus2,Affricumque,"Europa atque Asia , Affricumque littus",crije02.croala292491.croala-lat2w:body.div7.div5.l17.w4,,,,,,,,,,,,,,,,,,,,,,
estlocus1,Alpes,"Inuictus quid enim ? uix Alpes scandis , et ecce",crije02.croala292491.croala-lat2w:body.div1.div3.l11.w5,,,,,,,,,,,,,,,,,,,,,,
estlocus0,Alphonsi,"Illa uel Alphonsi uertice fulget aui ,",crije02.croala292491.croala-lat2w:body.div3.div11.l26.w3,,,,,,,,,,,,,,,,,,,,,,
estlocus1,Alpes,"Nec modo trans Alpes Pirenaeumque cucurrit ,",crije02.croala292491.croala-lat2w:body.div5.div2.l59.w4,,,,,,,,,,,,,,,,,,,,,,
estlocus3,Alpes,"Non Alpes te mille iugis arcere ruentem ,",crije02.croala292491.croala-lat2w:body.div5.div4.l446.w2,,,,,,,,,,,,,,,,,,,,,,
estlocus0,Alphonso,"Alphonso faueas , illum caelestibus armis",crije02.croala292491.croala-lat2w:body.div5.div5.l12.w1,,,,,,,,,,,,,,,,,,,,,,
estlocus1,Alpes,"Arma inter dux , miles eram Ludouicus : Alpes",crije02.croala292491.croala-lat2w:body.div7.div15.l1.w7,,,,,,,,,,,,,,,,,,,,,,
estlocus2,Alpinis,Hinc uolat Alpinis cuspis hyulca iugis .,crije02.croala292491.croala-lat2w:body.div7.div26.l44.w3,,,,,,,,,,,,,,,,,,,,,,
estlocus4,Amphionia,Quos Amphionia saxa habuere lyra .,crije02.croala292491.croala-lat2w:body.div6.div21.l4.w2,,,,,,,,,,,,,,,,,,,,,,
estlocus0,Amphioniam,"Suntque Amphioniam saxa secuta lyram ,",crije02.croala292491.croala-lat2w:body.div7.div32.l8.w2,,,,,,,,,,,,,,,,,,,,,,
estlocus1,Ancon,Hinc tibi nec priscis ingloria laudibus Ancon,crije02.croala292491.croala-lat2w:body.div3.div1.l109.w7,,,,,,,,,,,,,,,,,,,,,,
estlocus2,Anconis,"Seu Bari , Anconis moenia siue petet .",crije02.croala292491.croala-lat2w:body.div6.div5.l14.w3,,,,,,,,,,,,,,,,,,,,,,
estlocus2,Antenoreo,Siue Antenoreo genitrix Aquileia Timauo,crije02.croala292491.croala-lat2w:body.div1.div4.l17.w2,,,,,,,,,,,,,,,,,,,,,,
estlocus1,Antiliam,Vlteriusque feram nauiget Antiliam .,crije02.croala292491.croala-lat2w:body.div4.div16.l4.w4,,,,,,,,,,,,,,,,,,,,,,
estlocus1,Antiliaeque,"Antiliaeque , fero genus intractabile ritu ,",crije02.croala292491.croala-lat2w:body.div5.div2.l66.w1,,,,,,,,,,,,,,,,,,,,,,
estlocus4,Antipodasque,Signifer Antipodasque ima statione coaegit,crije02.croala292491.croala-lat2w:body.div5.div4.l100.w2,,,,,,,,,,,,,,,,,,,,,,
estlocus4,Aoniam,"Pulcher , ad Aoniam Calliopea lyram ,",crije02.croala292491.croala-lat2w:body.div7.div29.l2.w3,,,,,,,,,,,,,,,,,,,,,,
estlocus0,Apelles,"Nec tam Lisyppus , nec tam illustraret Apelles ,",crije02.croala292491.croala-lat2w:body.div1.div2.l171.w7,,,,,,,,,,,,,,,,,,,,,,
estlocus0,Apellaeam,Qualis Apellaeam commendat forma Dionen,crije02.croala292491.croala-lat2w:body.div1.div4.l1.w2,,,,,,,,,,,,,,,,,,,,,,
estlocus0,Apelles,Quis primus scelerum matrem depinxit ? Apelles .,crije02.croala292491.croala-lat2w:body.div1.div8.l23.w6,,,,,,,,,,,,,,,,,,,,,,
estlocus0,Apellaeis,Qualis Apellaeis genialiter insita caeris,crije02.croala292491.croala-lat2w:body.div5.div7.l55.w2,,,,,,,,,,,,,,,,,,,,,,
estlocus0,Apelleum,Pictor Apelleum comparat alter ebur ;,crije02.croala292491.croala-lat2w:body.div6.div3.l46.w2,,,,,,,,,,,,,,,,,,,,,,
estlocus1,Appeninus,"Transmittitque tuos glaciem Appeninus in usus ,",crije02.croala292491.croala-lat2w:body.div3.div1.l113.w4,,,,,,,,,,,,,,,,,,,,,,
estlocus0,Appia,Appia quod tenuit post saecula multa superstes,crije02.croala292491.croala-lat2w:body.div6.div2.l15.w1,,,,,,,,,,,,,,,,,,,,,,
estlocus0,Appia,Quam peregrinus odor seruabat et Appia tabis,crije02.croala292491.croala-lat2w:body.div6.div2.l81.w6,,,,,,,,,,,,,,,,,,,,,,
estlocus2,Appia,"Appia , Flamminia est siue terenda uia .",crije02.croala292491.croala-lat2w:body.div6.div5.l12.w1,,,,,,,,,,,,,,,,,,,,,,
estlocus0,Appulus,Roma suos . Pridem sensit rex Appulus illos,crije02.croala292491.croala-lat2w:body.div5.div4.l48.w6,,,,,,,,,,,,,,,,,,,,,,
estlocus1,Aquileia,Siue Antenoreo genitrix Aquileia Timauo,crije02.croala292491.croala-lat2w:body.div1.div4.l17.w4,,,,,,,,,,,,,,,,,,,,,,
estlocus0,Arabs,Indignum est uiolet sanguinolentus Arabs .,crije02.croala292491.croala-lat2w:body.div1.div1.l258.w5,,,,,,,,,,,,,,,,,,,,,,
estlocus3,Arabs,"Thrax , Scytha , Maurus , Arabs , concors ditione sub una ,",crije02.croala292491.croala-lat2w:body.div1.div3.l99.w4,,,,,,,,,,,,,,,,,,,,,,
estlocus0,Arabum,Vincis et fructus Arabum perenni,crije02.croala292491.croala-lat2w:body.div2.div3.l35.w4,,,,,,,,,,,,,,,,,,,,,,
estlocus0,Arabs," Occeanus felix , cinnama mittit Arabs .",crije02.croala292491.croala-lat2w:body.div3.div1.l70.w5,,,,,,,,,,,,,,,,,,,,,,
estlocus0,Arabs,Et quaecunque niger munera mittit Arabs .,crije02.croala292491.croala-lat2w:body.div4.div16.l16.w6,,,,,,,,,,,,,,,,,,,,,,
estlocus0,Arabs," Carpit decolor aut Arabs perustus ,",crije02.croala292491.croala-lat2w:body.div4.div23.l42.w4,,,,,,,,,,,,,,,,,,,,,,
estlocus0,Arabs,"Balsama , quaeque tenet thura opulentus Arabs ,",crije02.croala292491.croala-lat2w:body.div6.div2.l36.w6,,,,,,,,,,,,,,,,,,,,,,
estlocus0,Arabs,"Et quaecunque niger munera mittit Arabs ,",crije02.croala292491.croala-lat2w:body.div6.div3.l230.w6,,,,,,,,,,,,,,,,,,,,,,
estlocus0,Arabes,"Fulminat inque Arabes promouet arma feros ,",crije02.croala292491.croala-lat2w:body.div6.div29.l18.w3,,,,,,,,,,,,,,,,,,,,,,
estlocus0,Aragonium,Hoc quod Aragonium possidet omne genus .,crije02.croala292491.croala-lat2w:body.div3.div11.l4.w3,,,,,,,,,,,,,,,,,,,,,,
estlocus0,Aragonios,"Inter Aragonios illa recaepta suos ,",crije02.croala292491.croala-lat2w:body.div3.div11.l24.w2,,,,,,,,,,,,,,,,,,,,,,
estlocus0,Aragoni,"Aragoni , hinc sacrae consortia bella Thyane .",crije02.croala292491.croala-lat2w:body.div5.div4.l365.w1,,,,,,,,,,,,,,,,,,,,,,
estlocus1,Araxes,"Inque pios latices uerti exultabit Araxes ,",crije02.croala292491.croala-lat2w:body.div1.div3.l87.w6,,,,,,,,,,,,,,,,,,,,,,
estlocus1,Araxes," Nec tantam imperii molem eluctatus Araxes ,",crije02.croala292491.croala-lat2w:body.div6.div3.l169.w6,,,,,,,,,,,,,,,,,,,,,,
estlocus0,Archadas,Stellisque omnibus Archadas priores,crije02.croala292491.croala-lat2w:body.div4.div22.l10.w3,,,,,,,,,,,,,,,,,,,,,,
estlocus0,Archas,Mox Venus et Phoebi propior comes aliger Archas,crije02.croala292491.croala-lat2w:body.div5.div4.l117.w8,,,,,,,,,,,,,,,,,,,,,,
estlocus0,Archangelum,4 . In Archangelum Mich a elem,crije02.croala292491.croala-lat2w:body.div7.div4.head.w3,,,,,,,,,,,,,,,,,,,,,,
estlocus0,Archangelum,8 . Hymnus in Archangelum Gabrielem,crije02.croala292491.croala-lat2w:body.div7.div8.head.w4,,,,,,,,,,,,,,,,,,,,,,
estlocus0,Archangelum,9 . Hymnus in Archangelum Raphaelem,crije02.croala292491.croala-lat2w:body.div7.div9.head.w4,,,,,,,,,,,,,,,,,,,,,,
estlocus0,Archangelum,10 . In Archangelum Michaelem,crije02.croala292491.croala-lat2w:body.div7.div10.head.w3,,,,,,,,,,,,,,,,,,,,,,
estlocus0,Archangele,"Dum licet , exora , claemens Archangele , nostris",crije02.croala292491.croala-lat2w:body.div7.div10.l9.w5,,,,,,,,,,,,,,,,,,,,,,
estlocus4,Archtois,Dira uel Archtois piscibus esca natant ;,crije02.croala292491.croala-lat2w:body.div1.div2.l104.w3,,,,,,,,,,,,,,,,,,,,,,
estlocus2,Arctica,"Siue haec Haesperia est , siue Arctica stella uicissim ,",crije02.croala292491.croala-lat2w:body.div3.div11.l27.w6,,,,,,,,,,,,,,,,,,,,,,
estlocus1,Arctos,"Iure tuis igitur sociabilis Arctos habenis ,",crije02.croala292491.croala-lat2w:body.div1.div2.l81.w5,,,,,,,,,,,,,,,,,,,,,,
estlocus1,Arctos,Hesperus atque Arctos hanc meruere ducem .,crije02.croala292491.croala-lat2w:body.div3.div12.l4.w3,,,,,,,,,,,,,,,,,,,,,,
estlocus2,Arctoae,"Nam primum Arctoae censetur origine stellae ,",crije02.croala292491.croala-lat2w:body.div3.div12.l5.w3,,,,,,,,,,,,,,,,,,,,,,
estlocus1,Arctonque,"Vester honos , ultra Boreanque Arctonque rigentem",crije02.croala292491.croala-lat2w:body.div5.div2.l61.w5,,,,,,,,,,,,,,,,,,,,,,
estlocus0,Arctoasque,"Arctoasque manus , ripasque binominis Istri",crije02.croala292491.croala-lat2w:body.div5.div2.l114.w1,,,,,,,,,,,,,,,,,,,,,,
estlocus1,Arctos,"Arctos et Occasus corpus conspiret in unum ,",crije02.croala292491.croala-lat2w:body.div7.div20.l119.w1,,,,,,,,,,,,,,,,,,,,,,
estlocus1,Arctos,"Nanque Arctos Boreasque tonant , tonat Hesper et omnis",crije02.croala292491.croala-lat2w:body.div7.div26.l41.w2,,,,,,,,,,,,,,,,,,,,,,
estlocus0,Argoasque,Argoasque manus ipsamque impune Mineruam,crije02.croala292491.croala-lat2w:body.div3.div1.l79.w1,,,,,,,,,,,,,,,,,,,,,,
estlocus1,Arni,"Vos testes , fluuii hostiles innabilis Arni ,",crije02.croala292491.croala-lat2w:body.div5.div4.l443.w6,,,,,,,,,,,,,,,,,,,,,,
estlocus0,Arpinatis," Quale Arpinatis Musa poliuit , opus ,",crije02.croala292491.croala-lat2w:body.div6.div1.l16.w2,,,,,,,,,,,,,,,,,,,,,,
estlocus0,Ascraeus,"Quidquid et Ascraeus , quidquid bacchatur Homerus ,",crije02.croala292491.croala-lat2w:body.div6.div23.l79.w3,,,,,,,,,,,,,,,,,,,,,,
estlocus3,Assyriosque,"Assyriosque ultra tendes , Garabacthra , uel Indos ,",crije02.croala292491.croala-lat2w:body.div1.div3.l65.w1,,,,,,,,,,,,,,,,,,,,,,
estlocus4,Assyrii,"Vrror ut Assyrii templis urruntur odores ,",crije02.croala292491.croala-lat2w:body.div4.div4.l63.w3,,,,,,,,,,,,,,,,,,,,,,
estlocus4,Assyrio,Nuda nec Assyrio mersa liquore iacet .,crije02.croala292491.croala-lat2w:body.div6.div2.l84.w3,,,,,,,,,,,,,,,,,,,,,,
estlocus1,Asia,"Aequalesque dabunt Asia atque Europa triumphos ,",crije02.croala292491.croala-lat2w:body.div1.div3.l57.w3,,,,,,,,,,,,,,,,,,,,,,
estlocus0,Asiaticorum,"Asiaticorum instar tumidus , inanesque",crije02.croala292491.croala-lat2w:body.div1.div29.l3.w1,,,,,,,,,,,,,,,,,,,,,,
estlocus1,Asiam," Europam atque Asiam iactitet ille licet ,",crije02.croala292491.croala-lat2w:body.div3.div10.l18.w3,,,,,,,,,,,,,,,,,,,,,,
estlocus1,Asiae,"Aut Asiae molles uincere diuitiae ,",crije02.croala292491.croala-lat2w:body.div4.div3.l74.w2,,,,,,,,,,,,,,,,,,,,,,
estlocus1,Asia,"Europa atque Asia , Affricumque littus",crije02.croala292491.croala-lat2w:body.div7.div5.l17.w3,,,,,,,,,,,,,,,,,,,,,,
estlocus1,Asiae,"Europae atque Asiae multum concordibus armis ,",crije02.croala292491.croala-lat2w:body.div7.div20.l99.w3,,,,,,,,,,,,,,,,,,,,,,
estlocus1,Asia,"Nec modo pensabunt Asia atque Europa labores ,",crije02.croala292491.croala-lat2w:body.div7.div20.l131.w4,,,,,,,,,,,,,,,,,,,,,,
estlocus0,Athamantaeo,"Nunc Athamantaeo meliorem uellere lanam ,",crije02.croala292491.croala-lat2w:body.div3.div1.l81.w2,,,,,,,,,,,,,,,,,,,,,,
estlocus0,Athamantaeis,"Atque Athamantaeis actus erat Furiis ,",crije02.croala292491.croala-lat2w:body.div6.div30.l22.w2,,,,,,,,,,,,,,,,,,,,,,
estlocus1,Athlas,"Athlas caelifer , experire et offam",crije02.croala292491.croala-lat2w:body.div4.div23.l49.w1,,,,,,,,,,,,,,,,,,,,,,
estlocus1,Athlas,Opstupuitque humero grauiori caelifer Athlas .,crije02.croala292491.croala-lat2w:body.div5.div4.l106.w5,,,,,,,,,,,,,,,,,,,,,,
estlocus0,Athlanta,Caeliferumque novo strinxit Athlanta iugo .,crije02.croala292491.croala-lat2w:body.div6.div3.l176.w4,,,,,,,,,,,,,,,,,,,,,,
estlocus4,Athlas,"Continuum cuius torquet anhelus Athlas ,",crije02.croala292491.croala-lat2w:body.div7.div20.l28.w5,,,,,,,,,,,,,,,,,,,,,,
estlocus1,Athlas,Caucasus et caeli pondere pressus Athlas .,crije02.croala292491.croala-lat2w:body.div7.div26.l40.w6,,,,,,,,,,,,,,,,,,,,,,
estlocus1,Auentinum,"Praestat Auentinum furem et Busyridis aras ,",crije02.croala292491.croala-lat2w:body.div3.div3.l41.w2,,,,,,,,,,,,,,,,,,,,,,
estlocus1,Auentini,Furis Auentini specus et Scyronia rupes,crije02.croala292491.croala-lat2w:body.div3.div21.l75.w2,,,,,,,,,,,,,,,,,,,,,,
estlocus1,Auerna,"Noxia pestiferum uirus Auerna uomunt ,",crije02.croala292491.croala-lat2w:body.div3.div1.l52.w4,,,,,,,,,,,,,,,,,,,,,,
estlocus4,Auerna,"Nulla , nec infandae pestis Auerna times ,",crije02.croala292491.croala-lat2w:body.div4.div19.l34.w5,,,,,,,,,,,,,,,,,,,,,,
estlocus1,Auerni,"Visceribusque canes diras , passurus Auerni",crije02.croala292491.croala-lat2w:body.div6.div30.l45.w5,,,,,,,,,,,,,,,,,,,,,,
estlocus1,Aurorae,"Et procul Aurorae ditia regna suae ,",crije02.croala292491.croala-lat2w:body.div1.div1.l196.w3,,,,,,,,,,,,,,,,,,,,,,
estlocus0,Aurora,Gaudebitque Aurora modis spurcata nefandis,crije02.croala292491.croala-lat2w:body.div1.div3.l89.w2,,,,,,,,,,,,,,,,,,,,,,
estlocus0,Aurora,"Tristis et attonita est lachrymis Aurora gelatis ,",crije02.croala292491.croala-lat2w:body.div7.div26.l31.w6,,,,,,,,,,,,,,,,,,,,,,
estlocus4,Ausoniae,"I tamen , Ausoniae gentis decus , obuia quamuis",crije02.croala292491.croala-lat2w:body.div3.div3.l15.w3,,,,,,,,,,,,,,,,,,,,,,
estlocus4,Ausoniis,Temperat Ausoniis Martia castra modis .,crije02.croala292491.croala-lat2w:body.div3.div15.l16.w2,,,,,,,,,,,,,,,,,,,,,,
estlocus2,Ausonios,"Rursus et Ausonios pulsant proscenia colles ,",crije02.croala292491.croala-lat2w:body.div3.div17.l15.w3,,,,,,,,,,,,,,,,,,,,,,
estlocus4,Ausonia,"Necnon Ausonia procacitate ,",crije02.croala292491.croala-lat2w:body.div4.div1.l43.w2,,,,,,,,,,,,,,,,,,,,,,
estlocus1,Ausoniae,Scilicet Ausoniae laudantem numina laurus,crije02.croala292491.croala-lat2w:body.div5.div1.l73.w2,,,,,,,,,,,,,,,,,,,,,,
estlocus2,Ausonis,Vectura est humeris Ausonis ora suis .,crije02.croala292491.croala-lat2w:body.div7.div27.l12.w4,,,,,,,,,,,,,,,,,,,,,,
estlocus0,Austro,Transilies uolucri par atque simillimus Austro :,crije02.croala292491.croala-lat2w:body.div1.div3.l69.w6,,,,,,,,,,,,,,,,,,,,,,
estlocus4,Auster,"Haec loca foecundat Boreas , sed collis et Auster",crije02.croala292491.croala-lat2w:body.div3.div1.l33.w8,,,,,,,,,,,,,,,,,,,,,,
estlocus0,Auster,Non tamen abstineas cursu : licet horridus Auster,crije02.croala292491.croala-lat2w:body.div3.div3.l27.w7,,,,,,,,,,,,,,,,,,,,,,
estlocus0,Auster,"Quam cito purpureos flores malus inuidet Auster ,",crije02.croala292491.croala-lat2w:body.div4.div8.l17.w7,,,,,,,,,,,,,,,,,,,,,,
estlocus0,Auster,Mansuescunt posita uobis feritate nec Auster,crije02.croala292491.croala-lat2w:body.div5.div2.l68.w6,,,,,,,,,,,,,,,,,,,,,,
estlocus4,Babylonius,Lucrinus puer et piscis Babylonius et qui,crije02.croala292491.croala-lat2w:body.div3.div9.l1.w5,,,,,,,,,,,,,,,,,,,,,,
estlocus4,Babylonia,"Stellarum subitas Babylonia cura catheruas ,",crije02.croala292491.croala-lat2w:body.div5.div4.l104.w3,,,,,,,,,,,,,,,,,,,,,,
estlocus1,Bactra,Memnonias liquere domos atque ultima Bactra,crije02.croala292491.croala-lat2w:body.div1.div1.l195.w6,,,,,,,,,,,,,,,,,,,,,,
estlocus2,Baiarum,"Nec Capreas molles , Baiarum aut stagna requirat",crije02.croala292491.croala-lat2w:body.div4.div11.l47.w4,,,,,,,,,,,,,,,,,,,,,,
estlocus1,Baias,Credas nec ueteres fuisse Baias .,crije02.croala292491.croala-lat2w:body.div4.div20.l20.w5,,,,,,,,,,,,,,,,,,,,,,
estlocus0,Baisetus,"Baisetus uicit iusta per arma pater ,",crije02.croala292491.croala-lat2w:body.div5.div9.l4.w1,,,,,,,,,,,,,,,,,,,,,,
estlocus4,Baleari,"Verbere nunc glandes Baleari , grandinis instar .",crije02.croala292491.croala-lat2w:body.div5.div4.l292.w4,,,,,,,,,,,,,,,,,,,,,,
estlocus4,Bandala,"Bandala sat tulimus Sarranaque saecula , Romae",crije02.croala292491.croala-lat2w:body.div1.div5.l95.w1,,,,,,,,,,,,,,,,,,,,,,
estlocus4,Barculumque,Infestum mare Barculumque Teucamque,crije02.croala292491.croala-lat2w:body.div4.div20.l34.w3,,,,,,,,,,,,,,,,,,,,,,
estlocus4,Barculique,Incunabula Barculique littus,crije02.croala292491.croala-lat2w:body.div6.div38.l21.w2,,,,,,,,,,,,,,,,,,,,,,
estlocus2,Bari,"Seu Bari , Anconis moenia siue petet .",crije02.croala292491.croala-lat2w:body.div6.div5.l14.w2,,,,,,,,,,,,,,,,,,,,,,
estlocus0,Bassaricis,Nigraque Bassaricis India uicta choris .,crije02.croala292491.croala-lat2w:body.div4.div12.l40.w2,,,,,,,,,,,,,,,,,,,,,,
estlocus4,Berenicaea,Et Berenicaea clarior illa coma est .,crije02.croala292491.croala-lat2w:body.div3.div11.l34.w2,,,,,,,,,,,,,,,,,,,,,,
estlocus2,Bethlemica,Vtque recognoscunt Bethlemica culmina tantum,crije02.croala292491.croala-lat2w:body.div1.div1.l207.w3,,,,,,,,,,,,,,,,,,,,,,
estlocus0,Bianoreae,"Sisque Bianoreae dignus honore tubae ,",crije02.croala292491.croala-lat2w:body.div1.div7.l2.w2,,,,,,,,,,,,,,,,,,,,,,
estlocus0,Bizantiaci,"Non Bizantiaci gaza superba ducis ,",crije02.croala292491.croala-lat2w:body.div6.div3.l232.w2,,,,,,,,,,,,,,,,,,,,,,
estlocus2,Bizantia,"Quas Bizantia missitat Propontis , 5,15Quas...Propontis:versusadditusinmargine",crije02.croala292491.croala-lat2w:body.div7.div5.l15.w2,,,,,,,,,,,,,,,,,,,,,,
estlocus2,Boemo,Quae merito crines regno sociata Boemo,crije02.croala292491.croala-lat2w:body.div1.div2.l71.w6,,,,,,,,,,,,,,,,,,,,,,
estlocus0,Boemundum,Nemo Gothifredos desideret aut Boemundum,crije02.croala292491.croala-lat2w:body.div5.div2.l133.w5,,,,,,,,,,,,,,,,,,,,,,
estlocus4,Bootes,Teque Herimanthaeus torua cum matre Bootes,crije02.croala292491.croala-lat2w:body.div5.div4.l119.w6,,,,,,,,,,,,,,,,,,,,,,
estlocus0,Boreas,Quam laborantes Boreas et Eurus,crije02.croala292491.croala-lat2w:body.div2.div3.l9.w3,,,,,,,,,,,,,,,,,,,,,,
estlocus4,Boreas,"Haec loca foecundat Boreas , sed collis et Auster",crije02.croala292491.croala-lat2w:body.div3.div1.l33.w4,,,,,,,,,,,,,,,,,,,,,,
estlocus4,Boreas,"Hinc , uelut Aeolio Boreas animosus ab antro ,",crije02.croala292491.croala-lat2w:body.div3.div2.l31.w4,,,,,,,,,,,,,,,,,,,,,,
estlocus0,Boreanque,"Vester honos , ultra Boreanque Arctonque rigentem",crije02.croala292491.croala-lat2w:body.div5.div2.l61.w4,,,,,,,,,,,,,,,,,,,,,,
estlocus0,Boreas,"Horridus aut Boreas nudo deterruit axe ,",crije02.croala292491.croala-lat2w:body.div5.div4.l283.w3,,,,,,,,,,,,,,,,,,,,,,
estlocus4,Boreae,Et Rhodope et Boreae Martia regna trucis .,crije02.croala292491.croala-lat2w:body.div6.div2.l62.w4,,,,,,,,,,,,,,,,,,,,,,
estlocus0,Borea,Aufer et a Borea frigidiore domum ;,crije02.croala292491.croala-lat2w:body.div6.div23.l12.w4,,,,,,,,,,,,,,,,,,,,,,
estlocus4,Boreae,Et Rhesi et Boreae perfida regna trucis !,crije02.croala292491.croala-lat2w:body.div7.div20.l104.w4,,,,,,,,,,,,,,,,,,,,,,
estlocus0,Boreasque,"Nanque Arctos Boreasque tonant , tonat Hesper et omnis",crije02.croala292491.croala-lat2w:body.div7.div26.l41.w3,,,,,,,,,,,,,,,,,,,,,,
estlocus2,Borystenii,"Teque Borystenii latices uenerantur et Albis ,",crije02.croala292491.croala-lat2w:body.div1.div2.l87.w2,,,,,,,,,,,,,,,,,,,,,,
estlocus3,Britannos,Alter et extremo scrutetur in orbe Britannos,crije02.croala292491.croala-lat2w:body.div4.div16.l3.w7,,,,,,,,,,,,,,,,,,,,,,
estlocus1,Britannia,Orchades atque alio porrecta Britannia mundo,crije02.croala292491.croala-lat2w:body.div5.div2.l65.w5,,,,,,,,,,,,,,,,,,,,,,
estlocus0,Britannos,"Componit Gallosque Caledoniosque Britannos ,",crije02.croala292491.croala-lat2w:body.div5.div2.l111.w4,,,,,,,,,,,,,,,,,,,,,,
estlocus3,Britannos,Quod Tanaim Nilumque interiacet atque Britannos,crije02.croala292491.croala-lat2w:body.div6.div3.l171.w6,,,,,,,,,,,,,,,,,,,,,,
estlocus0,Britanne,"Nec fuit Occeanus , picte Britanne , tuus ,",crije02.croala292491.croala-lat2w:body.div6.div3.l174.w5,,,,,,,,,,,,,,,,,,,,,,
estlocus3,Britannis,"Quae uectantur ab ultimis Britannis ,",crije02.croala292491.croala-lat2w:body.div7.div5.l14.w5,,,,,,,,,,,,,,,,,,,,,,
estlocus1,Buda,"Non igitur proauos te sospite Buda requirat ,",crije02.croala292491.croala-lat2w:body.div1.div2.l63.w6,,,,,,,,,,,,,,,,,,,,,,
estlocus2,Cadmaea,"Laetior , aula nouos geminat Cadmaea triumphos .",crije02.croala292491.croala-lat2w:body.div5.div4.l241.w5,,,,,,,,,,,,,,,,,,,,,,
estlocus4,Calabrique,"Pontificis Calabrique ducis socia arma sequutum ,",crije02.croala292491.croala-lat2w:body.div5.div4.l357.w2,,,,,,,,,,,,,,,,,,,,,,
estlocus0,Calaber,"Bellipotens Calaber . Consors tamen utraque uirtus ,",crije02.croala292491.croala-lat2w:body.div5.div4.l370.w2,,,,,,,,,,,,,,,,,,,,,,
estlocus4,Caldaeique,"Caldaeique senes , praesaga quid astra loquantur",crije02.croala292491.croala-lat2w:body.div5.div4.l139.w1,,,,,,,,,,,,,,,,,,,,,,
estlocus2,Caledoniosque,"Componit Gallosque Caledoniosque Britannos ,",crije02.croala292491.croala-lat2w:body.div5.div2.l111.w3,,,,,,,,,,,,,,,,,,,,,,
estlocus4,Caledonio,Pulsa Caledonio terra fragore sonat ;,crije02.croala292491.croala-lat2w:body.div7.div26.l42.w2,,,,,,,,,,,,,,,,,,,,,,
estlocus1,Canopo,"Nec ueneranda fero regnabitur ora Canopo ,",crije02.croala292491.croala-lat2w:body.div1.div3.l79.w6,,,,,,,,,,,,,,,,,,,,,,
estlocus1,Canopus,"Sunt quorum extremus uela Canopus agit ,",crije02.croala292491.croala-lat2w:body.div3.div18.l2.w5,,,,,,,,,,,,,,,,,,,,,,
estlocus4,Canopus,"Tu mihi tu , Princeps , Helice , Cynosura , Canopus ,",crije02.croala292491.croala-lat2w:body.div3.div18.l7.w7,,,,,,,,,,,,,,,,,,,,,,
estlocus1,Canopum,Infidamque Pharum detestatamque Canopum,crije02.croala292491.croala-lat2w:body.div5.div2.l121.w4,,,,,,,,,,,,,,,,,,,,,,
estlocus2,Capharei,Ergo uel Aegeas hyemes et saxa Capharei,crije02.croala292491.croala-lat2w:body.div3.div21.l3.w7,,,,,,,,,,,,,,,,,,,,,,
estlocus2,Capitolino,"Nunc Capitolino rursus humata iugo ,",crije02.croala292491.croala-lat2w:body.div6.div2.l78.w2,,,,,,,,,,,,,,,,,,,,,,
estlocus1,Capreas,"Nec Capreas molles , Baiarum aut stagna requirat",crije02.croala292491.croala-lat2w:body.div4.div11.l47.w2,,,,,,,,,,,,,,,,,,,,,,
estlocus4,Caribdis,"Nec te , Sylla ferox , nec te uitasse , Caribdis ,",crije02.croala292491.croala-lat2w:body.div3.div21.l17.w8,,,,,,,,,,,,,,,,,,,,,,
estlocus4,Caribdis,"Profuit : interius Sylla , Caribdis eras !",crije02.croala292491.croala-lat2w:body.div3.div21.l18.w4,,,,,,,,,,,,,,,,,,,,,,
estlocus4,Caribdis,"Importunus hydrops , uorax Caribdis .",crije02.croala292491.croala-lat2w:body.div4.div22.l64.w4,,,,,,,,,,,,,,,,,,,,,,
estlocus4,Carybdis,"Miser , ah , miser , Carybdis",crije02.croala292491.croala-lat2w:body.div7.div31.l29.w4,,,,,,,,,,,,,,,,,,,,,,
estlocus1,Caucasus,"Parce tamen , parce , o , si te non Caucasus horrens",crije02.croala292491.croala-lat2w:body.div3.div2.l17.w8,,,,,,,,,,,,,,,,,,,,,,
estlocus4,Caucaseasque,"Caucaseasque niues et inhospita saxa Promethei ,",crije02.croala292491.croala-lat2w:body.div3.div3.l45.w1,,,,,,,,,,,,,,,,,,,,,,
estlocus4,Caucaseas,"Non ego Caucaseas uerear calcare pruinas ,",crije02.croala292491.croala-lat2w:body.div4.div4.l83.w3,,,,,,,,,,,,,,,,,,,,,,
estlocus4,Caucaseae,"Caucaseae possent quocum rubuisse pruinae ,",crije02.croala292491.croala-lat2w:body.div4.div11.l55.w1,,,,,,,,,,,,,,,,,,,,,,
