estLocus,Nomen,Textus,URN,,,,,,,,,,,,,,,,,,,,,,
estlocusX,Pannonicus,Sic tibi Pannonicus corpora sacra dabit ;,crije02.croala292491.croala-lat2w:body.div1.div5.l52.w3,,,,,,,,,,,,,,,,,,,,,,
estlocusX,Pannonici,"Quae modo Pannonici decorauit funera regis ,",crije02.croala292491.croala-lat2w:body.div3.div19.l45.w3,,,,,,,,,,,,,,,,,,,,,,
estlocusX,Papaeumne,"Papaeumne Scythae , Garamas Ammona , uel hircos ,",crije02.croala292491.croala-lat2w:body.div1.div5.l45.w1,,,,,,,,,,,,,,,,,,,,,,
estlocusX,Paphias,"Me tua simplicitas , Paphias imitata uolucres ,",crije02.croala292491.croala-lat2w:body.div4.div5.l7.w4,,,,,,,,,,,,,,,,,,,,,,
estlocusX,Parium,"Nec tanto Parium marmor candore superbit ,",crije02.croala292491.croala-lat2w:body.div4.div7.l3.w3,,,,,,,,,,,,,,,,,,,,,,
estlocusX,Parrhasis,"Inque unum corpus Parrhasis ursa coit ,",crije02.croala292491.croala-lat2w:body.div1.div2.l82.w4,,,,,,,,,,,,,,,,,,,,,,
estlocusX,Parrhasis,"Quas Cynosura rates , quas Parrhasis Vrsa gubernat ,",crije02.croala292491.croala-lat2w:body.div3.div18.l1.w5,,,,,,,,,,,,,,,,,,,,,,
estlocusX,Parthenope,"Regum Parthenope nec aula tanti est ,",crije02.croala292491.croala-lat2w:body.div4.div20.l21.w2,,,,,,,,,,,,,,,,,,,,,,
estlocusX,Parthenope,Parthenope ac placide tandem exarmata quiescat,crije02.croala292491.croala-lat2w:body.div5.div4.l55.w1,,,,,,,,,,,,,,,,,,,,,,
estlocusX,Parthica,"Quaeque uolant retro Parthica tela ferunt ,",crije02.croala292491.croala-lat2w:body.div4.div3.l58.w4,,,,,,,,,,,,,,,,,,,,,,
estlocusX,Parthos,"Neue ferocis equi ferientes inguina Parthos ,",crije02.croala292491.croala-lat2w:body.div4.div4.l53.w6,,,,,,,,,,,,,,,,,,,,,,
estlocusX,Parthique,"Messagetae , Turcaeque leues , Parthique fugaces ,",crije02.croala292491.croala-lat2w:body.div5.div4.l321.w4,,,,,,,,,,,,,,,,,,,,,,
estlocusX,Pausa,"O breuis , o uelox fugitiuaque , Pausa , uoluptas ,",crije02.croala292491.croala-lat2w:body.div3.div2.l1.w6,,,,,,,,,,,,,,,,,,,,,,
estlocusX,Pausa,"Durior o quouis , Pausa , labore mihi .",crije02.croala292491.croala-lat2w:body.div3.div2.l34.w4,,,,,,,,,,,,,,,,,,,,,,
estlocusX,Pansam,7 . Ad Pansam,crije02.croala292491.croala-lat2w:body.div6.div7.head.w3,,,,,,,,,,,,,,,,,,,,,,
estlocusX,Pansa,"Dignere aureolos credere , Pansa , decem !",crije02.croala292491.croala-lat2w:body.div6.div7.l12.w4,,,,,,,,,,,,,,,,,,,,,,
estlocusX,Pegasus,"Pegasus , aut glaucus Nymphis cognatus Arion ?",crije02.croala292491.croala-lat2w:body.div5.div4.l340.w1,,,,,,,,,,,,,,,,,,,,,,
estlocusX,Peliaco,Peliaco sic monte ferox sudauit Achilles,crije02.croala292491.croala-lat2w:body.div5.div4.l293.w1,,,,,,,,,,,,,,,,,,,,,,
estlocusX,Pelion,"Non uallum , non castra queant . Tu Pelion Ossae",crije02.croala292491.croala-lat2w:body.div5.div4.l448.w7,,,,,,,,,,,,,,,,,,,,,,
estlocusX,Pellaeum,"Pellaeum iuuenem , blandis dignatus ut ille",crije02.croala292491.croala-lat2w:body.div5.div1.l112.w1,,,,,,,,,,,,,,,,,,,,,,
estlocusX,Pellaei,Et modo Pellaei facta imitanda ducis .,crije02.croala292491.croala-lat2w:body.div6.div3.l54.w3,,,,,,,,,,,,,,,,,,,,,,
estlocusX,Pelopaea,"Non hic Thebana est aut Pelopaea domus ,",crije02.croala292491.croala-lat2w:body.div1.div2.l128.w6,,,,,,,,,,,,,,,,,,,,,,
estlocusX,Penelopea,Et centum admittat Penelopea procos .,crije02.croala292491.croala-lat2w:body.div6.div37.l18.w4,,,,,,,,,,,,,,,,,,,,,,
estlocusX,Pergama,"Instruxitque manus domituras Pergama , docti",crije02.croala292491.croala-lat2w:body.div5.div4.l294.w4,,,,,,,,,,,,,,,,,,,,,,
estlocusX,Persia,Siue Semiramia Persia diues acu ?,crije02.croala292491.croala-lat2w:body.div3.div27.l20.w3,,,,,,,,,,,,,,,,,,,,,,
estlocusX,Persia,Cuius durateis Persia cessit equis .,crije02.croala292491.croala-lat2w:body.div6.div18.l18.w3,,,,,,,,,,,,,,,,,,,,,,
estlocusX,Pestis,Pestis et extremum gliscet in Occeanum .,crije02.croala292491.croala-lat2w:body.div1.div5.l90.w1,,,,,,,,,,,,,,,,,,,,,,
estlocusX,Pestique,Currentem spinam Pestique rosaria damnet ?,crije02.croala292491.croala-lat2w:body.div2.div6.l117.w3,,,,,,,,,,,,,,,,,,,,,,
estlocusX,Paestanosque,Paestanosque olim redolentia basia flores,crije02.croala292491.croala-lat2w:body.div4.div8.l63.w1,,,,,,,,,,,,,,,,,,,,,,
estlocusX,Paestanas,Inter Paestanas siue iacere rosas .,crije02.croala292491.croala-lat2w:body.div4.div11.l52.w2,,,,,,,,,,,,,,,,,,,,,,
estlocusX,Paestanos,Nemo nec e spinis Paestanos carpere flores,crije02.croala292491.croala-lat2w:body.div4.div13.l11.w5,,,,,,,,,,,,,,,,,,,,,,
estlocusX,Pestem,"Pestem nobilitas auita , quam per",crije02.croala292491.croala-lat2w:body.div4.div22.l6.w1,,,,,,,,,,,,,,,,,,,,,,
estlocusX,Paestanas,Et sua Paestanas occupat aura rosas ;,crije02.croala292491.croala-lat2w:body.div6.div3.l140.w3,,,,,,,,,,,,,,,,,,,,,,
estlocusX,Pestiferosque,Pestiferosque oculis efflare nocentibus Affros,crije02.croala292491.croala-lat2w:body.div6.div23.l55.w1,,,,,,,,,,,,,,,,,,,,,,
estlocusX,Phaethontaeus,"Quid Phaethontaeus tulerit flagrantior ignis ,",crije02.croala292491.croala-lat2w:body.div2.div6.l90.w2,,,,,,,,,,,,,,,,,,,,,,
estlocusX,Phaethontaei,"Dux , Phaethontaei gloria magna Padi ,",crije02.croala292491.croala-lat2w:body.div3.div8.l20.w2,,,,,,,,,,,,,,,,,,,,,,
estlocusX,Phaethontaeas,"Seu Phaethontaeas non dedignata sorores ,",crije02.croala292491.croala-lat2w:body.div3.div11.l29.w2,,,,,,,,,,,,,,,,,,,,,,
estlocusX,Phaethontaeo,"Quem Phaethontaeo Ferraria misit ab amne ,",crije02.croala292491.croala-lat2w:body.div5.div4.l410.w2,,,,,,,,,,,,,,,,,,,,,,
estlocusX,Pharmacum,"Pharmacum diris animi uenenis ,",crije02.croala292491.croala-lat2w:body.div2.div5.l70.w1,,,,,,,,,,,,,,,,,,,,,,
estlocusX,Pharnessio,1 . Alexandro Pharnessio Cardinali suo principi,crije02.croala292491.croala-lat2w:body.div3.div1.head.w3,,,,,,,,,,,,,,,,,,,,,,
estlocusX,Pharum,Infidamque Pharum detestatamque Canopum,crije02.croala292491.croala-lat2w:body.div5.div2.l121.w2,,,,,,,,,,,,,,,,,,,,,,
estlocusX,Pharum,"Emendatque Pharum infidam , natumque nocentem",crije02.croala292491.croala-lat2w:body.div5.div9.l3.w2,,,,,,,,,,,,,,,,,,,,,,
estlocusX,Pharias,"Quantum Pompeius Pharias infamat harenas ,",crije02.croala292491.croala-lat2w:body.div6.div3.l267.w3,,,,,,,,,,,,,,,,,,,,,,
estlocusX,Pharii,Quod nisi iam Pharii aut Romani numinis instar,crije02.croala292491.croala-lat2w:body.div6.div8.l43.w4,,,,,,,,,,,,,,,,,,,,,,
estlocusX,Pheraeis,Scilicet et Phoebum campis armenta Pheraeis,crije02.croala292491.croala-lat2w:body.div4.div5.l41.w6,,,,,,,,,,,,,,,,,,,,,,
estlocusX,Phlaegraeum,Tu quoque Phlaegraeum si rupto monte uidebis,crije02.croala292491.croala-lat2w:body.div3.div3.l37.w3,,,,,,,,,,,,,,,,,,,,,,
estlocusX,Phlaegraea,"Neue canam stratos Phlaegraea ualle Gigantes ,",crije02.croala292491.croala-lat2w:body.div4.div4.l55.w4,,,,,,,,,,,,,,,,,,,,,,
estlocusX,Phocaeus,"Ocyus Euryalum Nisus , Phocaeus Orestem ,",crije02.croala292491.croala-lat2w:body.div1.div2.l133.w4,,,,,,,,,,,,,,,,,,,,,,
estlocusX,Phocidos,Hinc me Phocidos autumas parentem,crije02.croala292491.croala-lat2w:body.div4.div20.l9.w3,,,,,,,,,,,,,,,,,,,,,,
estlocusX,Phocaeus,Ecce suo praesto est iuuenis Phocaeus Oresti,crije02.croala292491.croala-lat2w:body.div5.div3.l60.w6,,,,,,,,,,,,,,,,,,,,,,
estlocusX,Phoebaea,"Nec Phoebaea tuum uincant oracula pectus ,",crije02.croala292491.croala-lat2w:body.div1.div2.l45.w2,,,,,,,,,,,,,,,,,,,,,,
estlocusX,Phoebaeo,Phoebaeo uideor blandius ore loqui .,crije02.croala292491.croala-lat2w:body.div4.div6.l52.w1,,,,,,,,,,,,,,,,,,,,,,
estlocusX,Phoebaeis,"Graccula Phoebaeis redimita incede corollis ,",crije02.croala292491.croala-lat2w:body.div6.div3.l113.w2,,,,,,,,,,,,,,,,,,,,,,
estlocusX,Phoebaeas,"Quare age Phoebaeas , uatum studiose , coronas",crije02.croala292491.croala-lat2w:body.div6.div3.l211.w3,,,,,,,,,,,,,,,,,,,,,,
estlocusX,Phoebe,"Phoebe , uale , ualeant Musae ; pia numina Christi",crije02.croala292491.croala-lat2w:body.div7.div45.l7.w1,,,,,,,,,,,,,,,,,,,,,,
estlocusX,Phoenicis,"Emendatque grauem Phoenicis more senectam ,",crije02.croala292491.croala-lat2w:body.div4.div8.l15.w3,,,,,,,,,,,,,,,,,,,,,,
estlocusX,Phoenix,"Inde tuo uultu iuuenescis , ut unica Phoenix ,",crije02.croala292491.croala-lat2w:body.div6.div1.l51.w7,,,,,,,,,,,,,,,,,,,,,,
estlocusX,Phoenix,"Suprema , ut Phoenix , sola 3,186solainmargine:tota perusta face :",crije02.croala292491.croala-lat2w:body.div6.div3.l186.w3,,,,,,,,,,,,,,,,,,,,,,
estlocusX,Phrygas,"Et Phrygas et nulla Lydia regna mora ,",crije02.croala292491.croala-lat2w:body.div1.div3.l64.w2,,,,,,,,,,,,,,,,,,,,,,
estlocusX,Phrygio,"Procreat , est Phrygio mater in ore Venus .",crije02.croala292491.croala-lat2w:body.div1.div4.l18.w3,,,,,,,,,,,,,,,,,,,,,,
estlocusX,Phrygios,"Num , precor , aut Phrygios Martia Roma deos ,",crije02.croala292491.croala-lat2w:body.div1.div5.l40.w4,,,,,,,,,,,,,,,,,,,,,,
estlocusX,Phrygas,Semiuirosque Phrygas et rustica pectora uito .,crije02.croala292491.croala-lat2w:body.div2.div7.l63.w2,,,,,,,,,,,,,,,,,,,,,,
estlocusX,Phrygio,"Splendida seu Phrygio struxit Elisa uiro ,",crije02.croala292491.croala-lat2w:body.div3.div16.l30.w3,,,,,,,,,,,,,,,,,,,,,,
estlocusX,Phrygiis,"Barbara seu Phrygiis conspiciare modis ,",crije02.croala292491.croala-lat2w:body.div4.div19.l110.w3,,,,,,,,,,,,,,,,,,,,,,
estlocusX,Phryxeum,Trans mare Phryxeum uilia terga dabit .,crije02.croala292491.croala-lat2w:body.div1.div3.l44.w3,,,,,,,,,,,,,,,,,,,,,,
estlocusX,Piceni,Testis Piceni nobilis ara soli .,crije02.croala292491.croala-lat2w:body.div1.div5.l64.w2,,,,,,,,,,,,,,,,,,,,,,
estlocusX,Picena,"Cuius pollueris macula , Picena , perenni ,",crije02.croala292491.croala-lat2w:body.div6.div3.l265.w4,,,,,,,,,,,,,,,,,,,,,,
estlocusX,Pictonumque,Pictonumque manus ; hinc uestra edicta uerentur,crije02.croala292491.croala-lat2w:body.div5.div2.l64.w1,,,,,,,,,,,,,,,,,,,,,,
estlocusX,Pierides,"At uos , Pierides , nostras expellite curas ,",crije02.croala292491.croala-lat2w:body.div4.div4.l69.w3,,,,,,,,,,,,,,,,,,,,,,
estlocusX,Pierio,Tempora Pierio sunt non innoxia uati .,crije02.croala292491.croala-lat2w:body.div5.div3.l84.w2,,,,,,,,,,,,,,,,,,,,,,
estlocusX,Pierides,"Vestraque turbauit gaudia , Pierides !",crije02.croala292491.croala-lat2w:body.div6.div3.l290.w4,,,,,,,,,,,,,,,,,,,,,,
estlocusX,Pieridas,Nam quia Pieridas castis pariterque Mineruam,crije02.croala292491.croala-lat2w:body.div6.div23.l29.w3,,,,,,,,,,,,,,,,,,,,,,
estlocusX,Pilii,Tempora quam Pilii desidiosa senis .,crije02.croala292491.croala-lat2w:body.div6.div3.l108.w3,,,,,,,,,,,,,,,,,,,,,,
estlocusX,Pirenaeumque,"Nec modo trans Alpes Pirenaeumque cucurrit ,",crije02.croala292491.croala-lat2w:body.div5.div2.l59.w5,,,,,,,,,,,,,,,,,,,,,,
estlocusX,Pithia,Ridet et exhausta Pithia sorde domus .,crije02.croala292491.croala-lat2w:body.div6.div3.l154.w4,,,,,,,,,,,,,,,,,,,,,,
estlocusX,Pythia,"Castus Apollineis cecinit qui Pythia templis ,",crije02.croala292491.croala-lat2w:body.div7.div53.l9.w5,,,,,,,,,,,,,,,,,,,,,,
estlocusX,Pleias,"Malle Leo potuit , tibi Pleias orta serena est ,",crije02.croala292491.croala-lat2w:body.div5.div4.l122.w5,,,,,,,,,,,,,,,,,,,,,,
estlocusX,Podalyriis,Ambobus Podalyriis futurus,crije02.croala292491.croala-lat2w:body.div4.div23.l83.w2,,,,,,,,,,,,,,,,,,,,,,
estlocusX,Poenitet,"Poenitet et longi littora curua maris ,",crije02.croala292491.croala-lat2w:body.div3.div21.l16.w1,,,,,,,,,,,,,,,,,,,,,,
estlocusX,Poenituisse,"Poenituisse sat est , satis est commissa fateri ,",crije02.croala292491.croala-lat2w:body.div4.div18.l65.w1,,,,,,,,,,,,,,,,,,,,,,
estlocusX,Poeniteat,Poeniteat precii : tanti est excellere et orbis,crije02.croala292491.croala-lat2w:body.div5.div1.l33.w1,,,,,,,,,,,,,,,,,,,,,,
estlocusX,Poenorum,Quod neque Poenorum furiis regisque Molossi,crije02.croala292491.croala-lat2w:body.div6.div2.l55.w3,,,,,,,,,,,,,,,,,,,,,,
estlocusX,Poenitet,Poenitet et fasces deposuisse tuos .,crije02.croala292491.croala-lat2w:body.div7.div20.l12.w1,,,,,,,,,,,,,,,,,,,,,,
estlocusX,Polonus,"Bracchataeque manus ; plaustris procul inde Polonus ,",crije02.croala292491.croala-lat2w:body.div5.div2.l98.w6,,,,,,,,,,,,,,,,,,,,,,
estlocusX,Pontica,"Gaudere et spoliis Pontica saxa meis ,",crije02.croala292491.croala-lat2w:body.div3.div21.l24.w4,,,,,,,,,,,,,,,,,,,,,,
estlocusX,Pontificis,"Pontificis Calabrique ducis socia arma sequutum ,",crije02.croala292491.croala-lat2w:body.div5.div4.l357.w1,,,,,,,,,,,,,,,,,,,,,,
estlocusX,Pontificisque,Regia Pontificisque simul conflata potestas,crije02.croala292491.croala-lat2w:body.div5.div4.l360.w2,,,,,,,,,,,,,,,,,,,,,,
estlocusX,Pontificis,"Pontificis Xysti Vrbinas , hinc Martius haeros",crije02.croala292491.croala-lat2w:body.div5.div4.l368.w1,,,,,,,,,,,,,,,,,,,,,,
estlocusX,Pontificem,Nec se Pontificem potius quam praestat amicum,crije02.croala292491.croala-lat2w:body.div7.div20.l79.w3,,,,,,,,,,,,,,,,,,,,,,
estlocusX,Pontifici,Sed quia Pontifici patriam duce et auspice Christo,crije02.croala292491.croala-lat2w:body.div7.div20.l85.w3,,,,,,,,,,,,,,,,,,,,,,
estlocusX,Pontificis,"Viscera , Pontificis pignora fida pii .",crije02.croala292491.croala-lat2w:body.div7.div20.l90.w2,,,,,,,,,,,,,,,,,,,,,,
estlocusX,Pontificem,"26 . De quercu , lilio , aquilis et oraculo ad Iulium II . Pontificem Maximum",crije02.croala292491.croala-lat2w:body.div7.div26.head.w11,,,,,,,,,,,,,,,,,,,,,,
estlocusX,Pontificis,33 . Epitaphium Iulii II . Pontificis,crije02.croala292491.croala-lat2w:body.div7.div33.head.w5,,,,,,,,,,,,,,,,,,,,,,
estlocusX,Pontificum,"Pontificum , Iuli , te nemo beatior esset ,",crije02.croala292491.croala-lat2w:body.div7.div38.l1.w1,,,,,,,,,,,,,,,,,,,,,,
estlocusX,Praenestinas,"An Praenestinas posset praestare sorores ,",crije02.croala292491.croala-lat2w:body.div1.div5.l41.w2,,,,,,,,,,,,,,,,,,,,,,
estlocusX,Preconesium,Quid Preconesium referam atque Armona relicto,crije02.croala292491.croala-lat2w:body.div6.div23.l73.w2,,,,,,,,,,,,,,,,,,,,,,
estlocusX,Propontis,"Quas Bizantia missitat Propontis , 5,15Quas...Propontis:versusadditusinmargine",crije02.croala292491.croala-lat2w:body.div7.div5.l15.w4,,,,,,,,,,,,,,,,,,,,,,
estlocusX,Propontis,"5 , 15 Quas . . . Propontis : versusadditusinmargine",crije02.croala292491.croala-lat2w:body.div7.div5.l15.note.w4,,,,,,,,,,,,,,,,,,,,,,
estlocusX,Prunetica,"Nec tua clausa licet Prunetica uirgo moratur ,",crije02.croala292491.croala-lat2w:body.div1.div5.l65.w5,,,,,,,,,,,,,,,,,,,,,,
estlocusX,Prunetica,"5 , 65 - 66 Nec tua modis inmargine : Seu longinqua loquor : testis Prunetica uirgo / Mirificis ciuis tranat ab urbe modis",crije02.croala292491.croala-lat2w:body.div1.div5.l66.note.w11,,,,,,,,,,,,,,,,,,,,,,
estlocusX,Punica,"Te modo uenturam , Punica lingua fuit ?",crije02.croala292491.croala-lat2w:body.div4.div10.l4.w4,,,,,,,,,,,,,,,,,,,,,,
estlocusX,Pyrene,"Hinc dea Pyrene flammata ceraunia torquet ,",crije02.croala292491.croala-lat2w:body.div7.div26.l43.w3,,,,,,,,,,,,,,,,,,,,,,
estlocusX,Quirinali,"Roma Quirinali tribuit quam uertice , non haec",crije02.croala292491.croala-lat2w:body.div3.div15.l45.w2,,,,,,,,,,,,,,,,,,,,,,
estlocusX,Quirinalis,Illa Quirinalis . Non est ea gloria Musis,crije02.croala292491.croala-lat2w:body.div5.div1.l62.w2,,,,,,,,,,,,,,,,,,,,,,
estlocusX,Quirinali,Nexa Quirinali porrige dona manu .,crije02.croala292491.croala-lat2w:body.div6.div3.l144.w2,,,,,,,,,,,,,,,,,,,,,,
estlocusX,Quirinalis,Moesta Quirinalis docta caterua iugi .,crije02.croala292491.croala-lat2w:body.div6.div3.l286.w2,,,,,,,,,,,,,,,,,,,,,,
estlocusX,Quirinalis,Iure Quirinalis gloria magna iugi .,crije02.croala292491.croala-lat2w:body.div6.div8.l42.w2,,,,,,,,,,,,,,,,,,,,,,
estlocusX,Quirites," Qui sibi cognatos quoties rexere Quirites ,",crije02.croala292491.croala-lat2w:body.div3.div14.l17.w6,,,,,,,,,,,,,,,,,,,,,,
estlocusX,Quirites,Romanus uetor Aelius . Quirites,crije02.croala292491.croala-lat2w:body.div4.div1.l70.w4,,,,,,,,,,,,,,,,,,,,,,
estlocusX,Quiritum,Ingens gloria traxerat Quiritum,crije02.croala292491.croala-lat2w:body.div4.div20.l6.w4,,,,,,,,,,,,,,,,,,,,,,
estlocusX,Quirites,"Felices igitur fortunatosque Quirites ,",crije02.croala292491.croala-lat2w:body.div5.div2.l102.w4,,,,,,,,,,,,,,,,,,,,,,
estlocusX,Quiritum,Atque aeuo sordere putes : iam parce Quiritum,crije02.croala292491.croala-lat2w:body.div5.div4.l12.w7,,,,,,,,,,,,,,,,,,,,,,
estlocusX,Quiritum,Factio seditioque grauis priuata Quiritum,crije02.croala292491.croala-lat2w:body.div5.div4.l168.w5,,,,,,,,,,,,,,,,,,,,,,
estlocusX,Quirites,"Attonita sint quae mirentur uoce Quirites ,",crije02.croala292491.croala-lat2w:body.div6.div3.l225.w6,,,,,,,,,,,,,,,,,,,,,,
estlocusX,Quiritum,"Nostris sensibus efflues , Quiritum",crije02.croala292491.croala-lat2w:body.div6.div6.l32.w4,,,,,,,,,,,,,,,,,,,,,,
estlocusX,Quiritum,"Hoc opibus geminoque mari titulisque Quiritum ,",crije02.croala292491.croala-lat2w:body.div6.div29.l29.w6,,,,,,,,,,,,,,,,,,,,,,
estlocusX,Quiritium,Bis prolesque Quiritium :,crije02.croala292491.croala-lat2w:body.div7.div1.l4.w3,,,,,,,,,,,,,,,,,,,,,,
estlocusX,Ragusaeo,20 . De Stagno oppido Ragusaeo,crije02.croala292491.croala-lat2w:body.div1.div20.head.w5,,,,,,,,,,,,,,,,,,,,,,
estlocusX,Ragusinis,suppl . Agic e mss . Ragusinis,crije02.croala292491.croala-lat2w:body.div5.div4.l177.note.emph.w5,,,,,,,,,,,,,,,,,,,,,,
estlocusX,Ragusa,"Ocelle mi , Ragusa , ocelle mi , patria ,",crije02.croala292491.croala-lat2w:body.div7.div1.l1.w3,,,,,,,,,,,,,,,,,,,,,,
estlocusX,Ragusa,Nunc Ragusa suum gaudet habere ducem ?,crije02.croala292491.croala-lat2w:body.div7.div2.l10.w2,,,,,,,,,,,,,,,,,,,,,,
estlocusX,Rhacusae,Nec mea Rhacusae merces ingloria uenit,crije02.croala292491.croala-lat2w:body.div1.div2.l13.w3,,,,,,,,,,,,,,,,,,,,,,
estlocusX,Rhacusio,Rhacusio aeternum carmine notus eris .,crije02.croala292491.croala-lat2w:body.div1.div2.l168.w1,,,,,,,,,,,,,,,,,,,,,,
estlocusX,Rhacusia,"Pro muro et clypeo est tellus Rhacusia , quamuis",crije02.croala292491.croala-lat2w:body.div1.div5.l83.w7,,,,,,,,,,,,,,,,,,,,,,
estlocusX,Rhacusia,"Perpetuumque libens Rhacusia tecta frequenta ,",crije02.croala292491.croala-lat2w:body.div1.div5.l119.w3,,,,,,,,,,,,,,,,,,,,,,
estlocusX,Rhacusae,Fulmina Rhacusae Vulcania credidit esse,crije02.croala292491.croala-lat2w:body.div1.div18.l1.w2,,,,,,,,,,,,,,,,,,,,,,
estlocusX,Rhacusa,"Mox ait : Hoc nisi te , Rhacusa , tuebere taelo ,",crije02.croala292491.croala-lat2w:body.div1.div18.l3.w6,,,,,,,,,,,,,,,,,,,,,,
estlocusX,Rhacusae,Haec noua Rhacusae finxit Baptista tuendae,crije02.croala292491.croala-lat2w:body.div1.div19.l1.w3,,,,,,,,,,,,,,,,,,,,,,
estlocusX,Rhagusae,Quem mihi Rhagusae publica cura dedit .,crije02.croala292491.croala-lat2w:body.div1.div20.l8.w3,,,,,,,,,,,,,,,,,,,,,,
estlocusX,Rhacusa,"Rhacusa et Blasii numina magna sui . 21,3-4:Opposuit...magnasuiinmargine:RhacusaopposuittotpropugnaculaStagni/EttutelarisnuminamagnaDei.",crije02.croala292491.croala-lat2w:body.div1.div21.l4.w1,,,,,,,,,,,,,,,,,,,,,,
estlocusX,Rhacusa,"21 , 3 - 4 : Opposuit . . . magna sui inmargine : Rhacusa opposuit tot propugnacula Stagni / Et tutelaris numina magna Dei .",crije02.croala292491.croala-lat2w:body.div1.div21.l4.note.w7,,,,,,,,,,,,,,,,,,,,,,
estlocusX,Rhacusa,Praeclusit Rhacusa uias molimine tanto,crije02.croala292491.croala-lat2w:body.div1.div22.l3.w2,,,,,,,,,,,,,,,,,,,,,,
estlocusX,Rhacusa,"Rhacusa ? Pendeo , catedra deserta est ,",crije02.croala292491.croala-lat2w:body.div1.div29.l18.w1,,,,,,,,,,,,,,,,,,,,,,
estlocusX,Rhacusa,"Quid ergo premii huic , Rhacusa , decernis ?",crije02.croala292491.croala-lat2w:body.div1.div29.l29.w5,,,,,,,,,,,,,,,,,,,,,,
estlocusX,Rhacusium,"Rhacusium , quod me ueteri praeponis Homero ,",crije02.croala292491.croala-lat2w:body.div2.div11.l1.w1,,,,,,,,,,,,,,,,,,,,,,
estlocusX,Rhacusae,Seu mage Rhacusae moenia tuta meae .,crije02.croala292491.croala-lat2w:body.div3.div3.l50.w3,,,,,,,,,,,,,,,,,,,,,,
estlocusX,Rhacusa,"Est tamen ingenuis diues Rhacusa puellis ,",crije02.croala292491.croala-lat2w:body.div3.div7.l49.w5,,,,,,,,,,,,,,,,,,,,,,
estlocusX,Rhacusiae," Nec nisi Rhacusiae mitis alumnus aquae ,",crije02.croala292491.croala-lat2w:body.div3.div9.l36.w3,,,,,,,,,,,,,,,,,,,,,,
estlocusX,Rhacusam,Rhacusam furis Aeliumque uatem,crije02.croala292491.croala-lat2w:body.div4.div20.l1.w1,,,,,,,,,,,,,,,,,,,,,,
estlocusX,Rhacusam,"Rhacusam , Illyrici decus , canisque",crije02.croala292491.croala-lat2w:body.div4.div20.l10.w1,,,,,,,,,,,,,,,,,,,,,,
estlocusX,Rhacusae,Rhacusae et proceres diu togatos .,crije02.croala292491.croala-lat2w:body.div4.div20.l16.w1,,,,,,,,,,,,,,,,,,,,,,
estlocusX,Rhacusam,"Inde prius quam te Rhacusam mittere passus ,",crije02.croala292491.croala-lat2w:body.div6.div1.l41.w5,,,,,,,,,,,,,,,,,,,,,,
estlocusX,Rhacusiam,Quid quod Rhacusiam semper poscentibus urbem,crije02.croala292491.croala-lat2w:body.div6.div4.l15.w3,,,,,,,,,,,,,,,,,,,,,,
estlocusX,Rhacusio,"Gondola , Rhacusio sanguine progenitus .",crije02.croala292491.croala-lat2w:body.div6.div28.l6.w2,,,,,,,,,,,,,,,,,,,,,,
estlocusX,Rhacusa,5 . Ad Sanctum Blasium pro Rhacusa,crije02.croala292491.croala-lat2w:body.div7.div5.head.w6,,,,,,,,,,,,,,,,,,,,,,
estlocusX,Rhacusae,"Rhacusae pater , o Blasi , clientem",crije02.croala292491.croala-lat2w:body.div7.div5.l1.w1,,,,,,,,,,,,,,,,,,,,,,
estlocusX,Rhacusam,"Rhacusam , Genitor , solo marique",crije02.croala292491.croala-lat2w:body.div7.div5.l10.w1,,,,,,,,,,,,,,,,,,,,,,
estlocusX,Rhacusam,"Vt tua Rhacusam doceat facundia , uellem",crije02.croala292491.croala-lat2w:body.div7.div28.l3.w3,,,,,,,,,,,,,,,,,,,,,,
estlocusX,Rhamnusia,"Seu scelus infandum Rhamnusia uendicat ultrix ,",crije02.croala292491.croala-lat2w:body.div6.div23.l89.w4,,,,,,,,,,,,,,,,,,,,,,
estlocusX,Rhamnusia,"Tu uero , qualis Rhamnusia iusta , per orbem",crije02.croala292491.croala-lat2w:body.div6.div30.l47.w4,,,,,,,,,,,,,,,,,,,,,,
estlocusX,Rhamnusia,Sic post terga uolat Rhamnusia sontibus et par,crije02.croala292491.croala-lat2w:body.div6.div32.l31.w5,,,,,,,,,,,,,,,,,,,,,,
estlocusX,Rheni,"Siue cathenati calcat fera cornua Rheni ,",crije02.croala292491.croala-lat2w:body.div3.div15.l23.w6,,,,,,,,,,,,,,,,,,,,,,
estlocusX,Rhenus," Moenia pellitae gentes , quas Rhenus et Ister",crije02.croala292491.croala-lat2w:body.div5.div2.l96.w5,,,,,,,,,,,,,,,,,,,,,,
estlocusX,Rhiphaeo,"Ibo ego Rhiphaeo qua coit unda gelu ,",crije02.croala292491.croala-lat2w:body.div4.div4.l86.w3,,,,,,,,,,,,,,,,,,,,,,
estlocusX,Rhodope,Et Rhodope et Boreae Martia regna trucis .,crije02.croala292491.croala-lat2w:body.div6.div2.l62.w2,,,,,,,,,,,,,,,,,,,,,,
estlocusX,Rodopeia,"Qui tamen ut rupes Rodopeia , siue Cytheron",crije02.croala292491.croala-lat2w:body.div6.div21.l5.w5,,,,,,,,,,,,,,,,,,,,,,
estlocusX,Rodope,"Heu , quantam cladem Rodope et Pangaea minantur ,",crije02.croala292491.croala-lat2w:body.div7.div20.l103.w4,,,,,,,,,,,,,,,,,,,,,,
estlocusX,Rodopeia,"Horrescunt Pangaea , pauent Rodopeia saxa ,",crije02.croala292491.croala-lat2w:body.div7.div26.l37.w4,,,,,,,,,,,,,,,,,,,,,,
estlocusX,Rodopeius,Nec dapibus foedis Rodopeius abstinet Orpheus,crije02.croala292491.croala-lat2w:body.div7.div53.l13.w4,,,,,,,,,,,,,,,,,,,,,,
estlocusX,Roma,Malluerit munus Martia Roma Tuum .,crije02.croala292491.croala-lat2w:body.div1.div1.l248.w4,,,,,,,,,,,,,,,,,,,,,,
estlocusX,Roma,"Gaudet in Illyrico littore Roma loqui ,",crije02.croala292491.croala-lat2w:body.div1.div2.l8.w5,,,,,,,,,,,,,,,,,,,,,,
estlocusX,Roma,Et gauisa sua maxima Roma manu .,crije02.croala292491.croala-lat2w:body.div1.div2.l12.w5,,,,,,,,,,,,,,,,,,,,,,
estlocusX,Roma," Saepeque fraternae conscia Roma necis ,",crije02.croala292491.croala-lat2w:body.div1.div2.l118.w4,,,,,,,,,,,,,,,,,,,,,,
estlocusX,Roma,Libera barbarico Roma secunda iugo .,crije02.croala292491.croala-lat2w:body.div1.div3.l52.w3,,,,,,,,,,,,,,,,,,,,,,
estlocusX,Romae,Et meminit Romae Martia facta suae .,crije02.croala292491.croala-lat2w:body.div1.div4.l68.w3,,,,,,,,,,,,,,,,,,,,,,
estlocusX,Romanis,Nec nisi Romanis aemula parque tuis .,crije02.croala292491.croala-lat2w:body.div1.div4.l72.w3,,,,,,,,,,,,,,,,,,,,,,
estlocusX,Roma,"Num , precor , aut Phrygios Martia Roma deos ,",crije02.croala292491.croala-lat2w:body.div1.div5.l40.w6,,,,,,,,,,,,,,,,,,,,,,
estlocusX,Roma,Sic tibi relliquiis Roma exossabitur omnis,crije02.croala292491.croala-lat2w:body.div1.div5.l53.w4,,,,,,,,,,,,,,,,,,,,,,
estlocusX,Romae,"Bandala sat tulimus Sarranaque saecula , Romae",crije02.croala292491.croala-lat2w:body.div1.div5.l95.w6,,,,,,,,,,,,,,,,,,,,,,
estlocusX,Romano," Quod , puto , Romano est de sanguine , nanque colonos",crije02.croala292491.croala-lat2w:body.div3.div4.l59.w3,,,,,,,,,,,,,,,,,,,,,,
estlocusX,Roma,Huc misit quondam Troia Roma suos .,crije02.croala292491.croala-lat2w:body.div3.div4.l60.w5,,,,,,,,,,,,,,,,,,,,,,
estlocusX,Romano,"Sanguine quod surgis Romano , hinc , Barbe , tuorum",crije02.croala292491.croala-lat2w:body.div3.div14.l1.w4,,,,,,,,,,,,,,,,,,,,,,
estlocusX,Romanos,Principe Romanos stare putamus auos .,crije02.croala292491.croala-lat2w:body.div3.div14.l8.w2,,,,,,,,,,,,,,,,,,,,,,
estlocusX,Romanos,Gaudet Romanos rex imitatus auos .,crije02.croala292491.croala-lat2w:body.div3.div15.l36.w2,,,,,,,,,,,,,,,,,,,,,,
estlocusX,Roma,"Roma Quirinali tribuit quam uertice , non haec",crije02.croala292491.croala-lat2w:body.div3.div15.l45.w1,,,,,,,,,,,,,,,,,,,,,,
estlocusX,Roma,E septemgeminis currere Roma iugis ;,crije02.croala292491.croala-lat2w:body.div3.div17.l24.w4,,,,,,,,,,,,,,,,,,,,,,
estlocusX,Roma,Viuere non alio sub Ioue Roma cupit .,crije02.croala292491.croala-lat2w:body.div3.div18.l16.w6,,,,,,,,,,,,,,,,,,,,,,
estlocusX,Roma,"Huic quoque mastrucas , Roma secunda , dabis .",crije02.croala292491.croala-lat2w:body.div3.div26.l8.w4,,,,,,,,,,,,,,,,,,,,,,
estlocusX,Romanus,Romanus uetor Aelius . Quirites,crije02.croala292491.croala-lat2w:body.div4.div1.l70.w1,,,,,,,,,,,,,,,,,,,,,,
estlocusX,Romae,"Et facundia Liuiana , Romae",crije02.croala292491.croala-lat2w:body.div4.div20.l7.w4,,,,,,,,,,,,,,,,,,,,,,
