estLocus,Nomen,Textus,URN,,,,,,,,,,,,,,,,,,,,,,
estlocusX,Libanus,"Nec modo fragranti Libanus desudat amomo ,",crije02.croala292491.croala-lat2w:body.div1.div1.l141.w4,,,,,,,,,,,,,,,,,,,,,,
estlocusX,Libanum,Siue sortita es Libanum parentem,crije02.croala292491.croala-lat2w:body.div2.div3.l7.w4,,,,,,,,,,,,,,,,,,,,,,
estlocusX,Librorum,"Librorum , proceres qui leges , iura docemus ,",crije02.croala292491.croala-lat2w:body.div1.div12.l9.w1,,,,,,,,,,,,,,,,,,,,,,
estlocusX,Librorum,"Librorum , loculos reuolue , quicquid",crije02.croala292491.croala-lat2w:body.div4.div23.l25.w1,,,,,,,,,,,,,,,,,,,,,,
estlocusX,Libraque,"Quem pia Virgo tenet Libraque lance pari ,",crije02.croala292491.croala-lat2w:body.div5.div10.l10.w5,,,,,,,,,,,,,,,,,,,,,,
estlocusX,Liburnorum,"Siue Liburnorum rostris seu diuite concha ,",crije02.croala292491.croala-lat2w:body.div1.div4.l35.w2,,,,,,,,,,,,,,,,,,,,,,
estlocusX,Liburna,Nuper in hostiles rostra Liburna rates .,crije02.croala292491.croala-lat2w:body.div1.div4.l80.w5,,,,,,,,,,,,,,,,,,,,,,
estlocusX,Licentia,"Illius comites efrena Licentia , Risus ,",crije02.croala292491.croala-lat2w:body.div1.div4.l53.w4,,,,,,,,,,,,,,,,,,,,,,
estlocusX,Licentia,Vndique deiecta iocunda Licentia zona,crije02.croala292491.croala-lat2w:body.div4.div12.l57.w4,,,,,,,,,,,,,,,,,,,,,,
estlocusX,Ligur,Cur non et cineres reddit Ligur ? Omne quod usquam est,crije02.croala292491.croala-lat2w:body.div1.div5.l49.w6,,,,,,,,,,,,,,,,,,,,,,
estlocusX,Longobardorum,"Longobardorum siue cruenta manus ,",crije02.croala292491.croala-lat2w:body.div6.div2.l60.w1,,,,,,,,,,,,,,,,,,,,,,
estlocusX,Lucifer,Qualem mane suo Lucifer efflat equo ;,crije02.croala292491.croala-lat2w:body.div1.div4.l10.w4,,,,,,,,,,,,,,,,,,,,,,
estlocusX,Lucifer,"Lucifer aut roseis afflet anhelus equis ,",crije02.croala292491.croala-lat2w:body.div6.div23.l14.w1,,,,,,,,,,,,,,,,,,,,,,
estlocusX,Lucifer,"Tristis et in primo caligat Lucifer ortu ,",crije02.croala292491.croala-lat2w:body.div7.div26.l33.w6,,,,,,,,,,,,,,,,,,,,,,
estlocusX,Lucrinus,Lucrinus puer et piscis Babylonius et qui,crije02.croala292491.croala-lat2w:body.div3.div9.l1.w1,,,,,,,,,,,,,,,,,,,,,,
estlocusX,Luna,"Defectum languere 2,165languereinmargine:pallere diem intermenstrua Luna",crije02.croala292491.croala-lat2w:body.div2.div2.l165.w5,,,,,,,,,,,,,,,,,,,,,,
estlocusX,Luna,Vnde micant stellae et uaga Luna reciprocat orbem,crije02.croala292491.croala-lat2w:body.div2.div4.l4.w6,,,,,,,,,,,,,,,,,,,,,,
estlocusX,Luna,Cum quater umbriferis Luna recurret equis .,crije02.croala292491.croala-lat2w:body.div3.div19.l58.w4,,,,,,,,,,,,,,,,,,,,,,
estlocusX,Luna,"Illo Iuppiter , hoc colore Luna est .",crije02.croala292491.croala-lat2w:body.div3.div29.l25.w5,,,,,,,,,,,,,,,,,,,,,,
estlocusX,Lunaque,Lunaque noctiuago fauit uelocior axe ;,crije02.croala292491.croala-lat2w:body.div5.div4.l118.w1,,,,,,,,,,,,,,,,,,,,,,
estlocusX,Luna,"Tardus eris uel cum menstrua Luna coit ,",crije02.croala292491.croala-lat2w:body.div6.div23.l44.w6,,,,,,,,,,,,,,,,,,,,,,
estlocusX,Lyaeum,Indigenam iussi et proprium potare Lyaeum,crije02.croala292491.croala-lat2w:body.div1.div31.l7.w6,,,,,,,,,,,,,,,,,,,,,,
estlocusX,Lyaeo,Fertur abortiuo nec tam praestasse Lyaeo,crije02.croala292491.croala-lat2w:body.div3.div7.l29.w6,,,,,,,,,,,,,,,,,,,,,,
estlocusX,Lyaeus,"Conuiua , et Ceres , et pater Lyaeus :",crije02.croala292491.croala-lat2w:body.div3.div29.l12.w6,,,,,,,,,,,,,,,,,,,,,,
estlocusX,Lyaeus,Ventilat intonsos crines per colla Lyaeus,crije02.croala292491.croala-lat2w:body.div5.div4.l236.w6,,,,,,,,,,,,,,,,,,,,,,
estlocusX,Lybici,Decolor et Lybici uernat harena soli .,crije02.croala292491.croala-lat2w:body.div1.div1.l148.w3,,,,,,,,,,,,,,,,,,,,,,
estlocusX,Lybicos,"Obsequium Lybicos fecit parere leones ,",crije02.croala292491.croala-lat2w:body.div4.div5.l53.w2,,,,,,,,,,,,,,,,,,,,,,
estlocusX,Lybici,Floribus et Lybici uernet harena soli .,crije02.croala292491.croala-lat2w:body.div4.div11.l56.w3,,,,,,,,,,,,,,,,,,,,,,
estlocusX,Lybiae,"Nec Lybiae refugo circumferar aequore , uectet",crije02.croala292491.croala-lat2w:body.div4.div16.l7.w2,,,,,,,,,,,,,,,,,,,,,,
estlocusX,Lybiae,Vt uel harenoso Lybiae sitientis in aestu,crije02.croala292491.croala-lat2w:body.div4.div16.l21.w4,,,,,,,,,,,,,,,,,,,,,,
estlocusX,Lybicis,"Ergo quod Lybicis uiret Cyrenis ,",crije02.croala292491.croala-lat2w:body.div4.div23.l47.w3,,,,,,,,,,,,,,,,,,,,,,
estlocusX,Lybici,Armantur Lybici mora leones .,crije02.croala292491.croala-lat2w:body.div4.div23.l76.w2,,,,,,,,,,,,,,,,,,,,,,
estlocusX,Lybicos,Fulmineis premere et Lybicos optare leones,crije02.croala292491.croala-lat2w:body.div5.div4.l274.w4,,,,,,,,,,,,,,,,,,,,,,
estlocusX,Lycambaeo,Tincta Lycambaeo spicula felle petant :,crije02.croala292491.croala-lat2w:body.div3.div21.l98.w2,,,,,,,,,,,,,,,,,,,,,,
estlocusX,Lycaonias,Siue Lycaonias comminus ire niues .,crije02.croala292491.croala-lat2w:body.div4.div4.l84.w2,,,,,,,,,,,,,,,,,,,,,,
estlocusX,Lychaoniis,"Siue Lychaoniis Helice demisit ab astris ,",crije02.croala292491.croala-lat2w:body.div5.div4.l20.w2,,,,,,,,,,,,,,,,,,,,,,
estlocusX,Lydia,"Et Phrygas et nulla Lydia regna mora ,",crije02.croala292491.croala-lat2w:body.div1.div3.l64.w5,,,,,,,,,,,,,,,,,,,,,,
estlocusX,Lydia,Semper et inuitam Lydia terra petat .,crije02.croala292491.croala-lat2w:body.div1.div5.l120.w4,,,,,,,,,,,,,,,,,,,,,,
estlocusX,Lydius,"Lydius ut lapis , hoc ratio discernit ab illo ,",crije02.croala292491.croala-lat2w:body.div2.div6.l120.w1,,,,,,,,,,,,,,,,,,,,,,
estlocusX,Lydia,"Vos , Thusci , sensistis , agri , uos , Lydia culta ,",crije02.croala292491.croala-lat2w:body.div5.div4.l442.w6,,,,,,,,,,,,,,,,,,,,,,
estlocusX,Lynceis,Sed Sors prouida Lynceis ocellis :,crije02.croala292491.croala-lat2w:body.div3.div29.l30.w4,,,,,,,,,,,,,,,,,,,,,,
estlocusX,Lynceis,"Nec sint inuia Lynceis ocellis ,",crije02.croala292491.croala-lat2w:body.div3.div29.l33.w4,,,,,,,,,,,,,,,,,,,,,,
estlocusX,Lyncea,Cuius inaccessum penetrauit Lyncea caelum,crije02.croala292491.croala-lat2w:body.div7.div52.l1.w4,,,,,,,,,,,,,,,,,,,,,,
estlocusX,Maeandrius,Errat et alternis uicibus Maeandrius amnis,crije02.croala292491.croala-lat2w:body.div5.div4.l313.w5,,,,,,,,,,,,,,,,,,,,,,
estlocusX,Maeonidem,"Maeonidem decet Ares , Ares , uitioque quod aeui est ,",crije02.croala292491.croala-lat2w:body.div5.div7.l42.w1,,,,,,,,,,,,,,,,,,,,,,
estlocusX,Maeonidae,Maeonidae uates et magni fama fatigat,crije02.croala292491.croala-lat2w:body.div6.div3.l51.w1,,,,,,,,,,,,,,,,,,,,,,
estlocusX,Maeonides,Maeonides uatum maximus ille docet .,crije02.croala292491.croala-lat2w:body.div7.div20.l60.w1,,,,,,,,,,,,,,,,,,,,,,
estlocusX,Malaeae,Ah ego Cyaneas mallem rupesque Malaeae,crije02.croala292491.croala-lat2w:body.div3.div21.l23.w6,,,,,,,,,,,,,,,,,,,,,,
estlocusX,Mamertinis,"Seu Mamertinis potius , pro crimine quorum",crije02.croala292491.croala-lat2w:body.div6.div29.l7.w2,,,,,,,,,,,,,,,,,,,,,,
estlocusX,Mantua,"Nec Mediolanum , nec Mantua lumine sicco est ,",crije02.croala292491.croala-lat2w:body.div3.div11.l7.w4,,,,,,,,,,,,,,,,,,,,,,
estlocusX,Mantua,Quo nunc Virgilio est Mantua laeta nouo .,crije02.croala292491.croala-lat2w:body.div7.div53.l34.w5,,,,,,,,,,,,,,,,,,,,,,
estlocusX,Marmaricus,"Non leo Marmaricus nec abacto pignore tigris ,",crije02.croala292491.croala-lat2w:body.div6.div30.l1.w3,,,,,,,,,,,,,,,,,,,,,,
estlocusX,Marrucinam,"Dum Marrucinam nuper praeteruehor arcem ,",crije02.croala292491.croala-lat2w:body.div1.div6.l1.w2,,,,,,,,,,,,,,,,,,,,,,
estlocusX,Marrucinos,Qui Marrucinos passus non principe uiso,crije02.croala292491.croala-lat2w:body.div1.div6.l9.w2,,,,,,,,,,,,,,,,,,,,,,
estlocusX,Martia,Malluerit munus Martia Roma Tuum .,crije02.croala292491.croala-lat2w:body.div1.div1.l248.w3,,,,,,,,,,,,,,,,,,,,,,
estlocusX,Martis,"Altera Vulcani , Martis et uxor erit ,",crije02.croala292491.croala-lat2w:body.div1.div4.l64.w3,,,,,,,,,,,,,,,,,,,,,,
estlocusX,Martia,Et meminit Romae Martia facta suae .,crije02.croala292491.croala-lat2w:body.div1.div4.l68.w4,,,,,,,,,,,,,,,,,,,,,,
estlocusX,Martia,"Num , precor , aut Phrygios Martia Roma deos ,",crije02.croala292491.croala-lat2w:body.div1.div5.l40.w5,,,,,,,,,,,,,,,,,,,,,,
estlocusX,Martia,Temperat Ausoniis Martia castra modis .,crije02.croala292491.croala-lat2w:body.div3.div15.l16.w3,,,,,,,,,,,,,,,,,,,,,,
estlocusX,Martinalia,Martinalia nunc hyems reuexit :,crije02.croala292491.croala-lat2w:body.div3.div29.l1.w1,,,,,,,,,,,,,,,,,,,,,,
estlocusX,Martinalia,Martinalia caelitus secundent,crije02.croala292491.croala-lat2w:body.div3.div29.l19.w1,,,,,,,,,,,,,,,,,,,,,,
estlocusX,Martia,Armorumque acies et Martia bella ualebunt :,crije02.croala292491.croala-lat2w:body.div4.div3.l37.w4,,,,,,,,,,,,,,,,,,,,,,
estlocusX,Martis,"Accingar pugnas et graue Martis opus ,",crije02.croala292491.croala-lat2w:body.div4.div4.l8.w5,,,,,,,,,,,,,,,,,,,,,,
estlocusX,Martia,"Exclusit laurum , Martia serta , meam ,",crije02.croala292491.croala-lat2w:body.div4.div4.l14.w3,,,,,,,,,,,,,,,,,,,,,,
estlocusX,Martis,"Nec fera sanguinei uacat hiscere praelia Martis ,",crije02.croala292491.croala-lat2w:body.div4.div4.l15.w7,,,,,,,,,,,,,,,,,,,,,,
estlocusX,Martisque,"Quis uero fera bella canat Martisque furorem ,",crije02.croala292491.croala-lat2w:body.div4.div4.l23.w6,,,,,,,,,,,,,,,,,,,,,,
estlocusX,Martia,Et rapit imbellis Martia taela Venus .,crije02.croala292491.croala-lat2w:body.div4.div4.l48.w4,,,,,,,,,,,,,,,,,,,,,,
estlocusX,Martia,"Quales Martia uirgo uix recuset ,",crije02.croala292491.croala-lat2w:body.div4.div20.l14.w2,,,,,,,,,,,,,,,,,,,,,,
estlocusX,Marti,Bellatrix nec adhuc saeuoque accommoda Marti,crije02.croala292491.croala-lat2w:body.div5.div4.l159.w6,,,,,,,,,,,,,,,,,,,,,,
estlocusX,Martis,Tunc tu uel clypeo potuisses ludere Martis,crije02.croala292491.croala-lat2w:body.div5.div4.l217.w7,,,,,,,,,,,,,,,,,,,,,,
estlocusX,Martis,Belligeros inter lusus simulacraque Martis,crije02.croala292491.croala-lat2w:body.div5.div4.l317.w5,,,,,,,,,,,,,,,,,,,,,,
estlocusX,Martis,Martis et auctores geminos : hinc robora regis,crije02.croala292491.croala-lat2w:body.div5.div4.l364.w1,,,,,,,,,,,,,,,,,,,,,,
estlocusX,Martius,"Pontificis Xysti Vrbinas , hinc Martius haeros",crije02.croala292491.croala-lat2w:body.div5.div4.l368.w5,,,,,,,,,,,,,,,,,,,,,,
estlocusX,Martia,Et Rhodope et Boreae Martia regna trucis .,crije02.croala292491.croala-lat2w:body.div6.div2.l62.w5,,,,,,,,,,,,,,,,,,,,,,
estlocusX,Martia,Allicere officiis Martia Roma suis .,crije02.croala292491.croala-lat2w:body.div6.div2.l68.w3,,,,,,,,,,,,,,,,,,,,,,
estlocusX,Martia,Natali uideat Martia Roma suo !,crije02.croala292491.croala-lat2w:body.div6.div3.l242.w3,,,,,,,,,,,,,,,,,,,,,,
estlocusX,Mauors," Cum iuueni Mauors insidiatus erat ,",crije02.croala292491.croala-lat2w:body.div4.div2.l2.w3,,,,,,,,,,,,,,,,,,,,,,
estlocusX,Mauors,Et licet hic Mauors sudorem abstergat anhelum,crije02.croala292491.croala-lat2w:body.div4.div11.l25.w4,,,,,,,,,,,,,,,,,,,,,,
estlocusX,Mauortia,Et faciles diuos meruit Mauortia tellus,crije02.croala292491.croala-lat2w:body.div5.div1.l77.w5,,,,,,,,,,,,,,,,,,,,,,
estlocusX,Mauortia,Dissona barbaries foribus ; Mauortia poscunt,crije02.croala292491.croala-lat2w:body.div5.div2.l95.w4,,,,,,,,,,,,,,,,,,,,,,
estlocusX,Mauors,Robora praelusit Mauors uiresque futuras .,crije02.croala292491.croala-lat2w:body.div5.div4.l113.w3,,,,,,,,,,,,,,,,,,,,,,
estlocusX,Mauortis,Imperium et summam patrii Mauortis agebat,crije02.croala292491.croala-lat2w:body.div5.div4.l369.w5,,,,,,,,,,,,,,,,,,,,,,
estlocusX,Massagethae,"Tristia nec duri pocula Massagethae ,",crije02.croala292491.croala-lat2w:body.div4.div4.l54.w5,,,,,,,,,,,,,,,,,,,,,,
estlocusX,Messagetae,"Messagetae , Turcaeque leues , Parthique fugaces ,",crije02.croala292491.croala-lat2w:body.div5.div4.l321.w1,,,,,,,,,,,,,,,,,,,,,,
estlocusX,Maurus,"Thrax , Scytha , Maurus , Arabs , concors ditione sub una ,",crije02.croala292491.croala-lat2w:body.div1.div3.l99.w3,,,,,,,,,,,,,,,,,,,,,,
estlocusX,Maurusia,"Principe Fernando , qui nunc Maurusia regna",crije02.croala292491.croala-lat2w:body.div6.div29.l17.w5,,,,,,,,,,,,,,,,,,,,,,
estlocusX,Insula,Insula et a medio nomen adepta situ .,crije02.croala292491.croala-lat2w:body.div3.div1.l8.w1,,,,,,,,,,,,,,,,,,,,,,
estlocusX,Medium,Altera debilitat . Medium simplexque probamus ;,crije02.croala292491.croala-lat2w:body.div2.div7.l62.w3,,,,,,,,,,,,,,,,,,,,,,
estlocusX,Media,Qua prope contiguis Media est utrinque duabus,crije02.croala292491.croala-lat2w:body.div3.div1.l7.w4,,,,,,,,,,,,,,,,,,,,,,
estlocusX,Mediolanum,"Nec Mediolanum , nec Mantua lumine sicco est ,",crije02.croala292491.croala-lat2w:body.div3.div11.l7.w2,,,,,,,,,,,,,,,,,,,,,,
estlocusX,Medices,Ad Medices magno foenore laeta redit .,crije02.croala292491.croala-lat2w:body.div7.div20.l30.w2,,,,,,,,,,,,,,,,,,,,,,
estlocusX,Medices,"Sic Medices cessare iuuat , post ocia quorum",crije02.croala292491.croala-lat2w:body.div7.div20.l33.w2,,,,,,,,,,,,,,,,,,,,,,
estlocusX,Medices,Vulneribus Medices inualuere suis :,crije02.croala292491.croala-lat2w:body.div7.div20.l36.w2,,,,,,,,,,,,,,,,,,,,,,
estlocusX,Meletaeas,Atque Meletaeas ducere propter aquas ;,crije02.croala292491.croala-lat2w:body.div7.div41.l12.w2,,,,,,,,,,,,,,,,,,,,,,
estlocusX,Memnonias,Memnonias liquere domos atque ultima Bactra,crije02.croala292491.croala-lat2w:body.div1.div1.l195.w1,,,,,,,,,,,,,,,,,,,,,,
estlocusX,Memnonio,Memnonio qualis funere uisa fuit ;,crije02.croala292491.croala-lat2w:body.div7.div26.l32.w1,,,,,,,,,,,,,,,,,,,,,,
estlocusX,Memphys,"Cum Memphys illi , cum barbara texerit Helle",crije02.croala292491.croala-lat2w:body.div3.div27.l19.w2,,,,,,,,,,,,,,,,,,,,,,
estlocusX,Mephytis,"Nec caelum nec aquas contaminat ulla Mephytis ,",crije02.croala292491.croala-lat2w:body.div3.div1.l53.w7,,,,,,,,,,,,,,,,,,,,,,
estlocusX,Mephytis,"Dira peregrino quae fluxit ab orbe Mephytis ,",crije02.croala292491.croala-lat2w:body.div4.div19.l37.w7,,,,,,,,,,,,,,,,,,,,,,
estlocusX,Messana,"Hic tibi non solum laudi est , Messana , triumphus",crije02.croala292491.croala-lat2w:body.div6.div29.l23.w7,,,,,,,,,,,,,,,,,,,,,,
estlocusX,Methymnaeum,Et Methymnaeum qui uexit Ariona delphin,crije02.croala292491.croala-lat2w:body.div3.div9.l3.w2,,,,,,,,,,,,,,,,,,,,,,
estlocusX,Micenae,"Quod refugo infames mirentur sole Micenae ,",crije02.croala292491.croala-lat2w:body.div1.div2.l117.w6,,,,,,,,,,,,,,,,,,,,,,
estlocusX,Milesi,Milesi solos imitari conscia mores,crije02.croala292491.croala-lat2w:body.div3.div21.l93.w1,,,,,,,,,,,,,,,,,,,,,,
estlocusX,Milesi,"Aut quae Milesi lana colore rubet ,",crije02.croala292491.croala-lat2w:body.div4.div6.l18.w3,,,,,,,,,,,,,,,,,,,,,,
estlocusX,Milesia," Nec tantum uitient Milesia siue Tarentum ,",crije02.croala292491.croala-lat2w:body.div6.div37.l13.w4,,,,,,,,,,,,,,,,,,,,,,
estlocusX,Mincius,Intumuit lachrymis Mincius ecce tuis .,crije02.croala292491.croala-lat2w:body.div3.div11.l12.w3,,,,,,,,,,,,,,,,,,,,,,
estlocusX,Mincius,"Piscosis una meruit quem Mincius undis ,",crije02.croala292491.croala-lat2w:body.div5.div4.l411.w5,,,,,,,,,,,,,,,,,,,,,,
estlocusX,Minoia,"Tu quoque sanescis frustra , Minoia proles ,",crije02.croala292491.croala-lat2w:body.div6.div1.l59.w5,,,,,,,,,,,,,,,,,,,,,,
estlocusX,Missenis,"Siue es Missenis inclyta nobilibus ,",crije02.croala292491.croala-lat2w:body.div6.div29.l6.w3,,,,,,,,,,,,,,,,,,,,,,
estlocusX,Moseia,"Et sacris censetur auis , Moseia plebes ,",crije02.croala292491.croala-lat2w:body.div2.div2.l124.w5,,,,,,,,,,,,,,,,,,,,,,
estlocusX,Musaeo,"Musaeo ingluuiem , Sardanapalle , tuam ?",crije02.croala292491.croala-lat2w:body.div7.div53.l16.w1,,,,,,,,,,,,,,,,,,,,,,
estlocusX,Mutinae,Caelestis Mutinae decus perenne .,crije02.croala292491.croala-lat2w:body.div4.div23.l89.w2,,,,,,,,,,,,,,,,,,,,,,
estlocusX,Myrrina,Si fuit ardoris Myrrina causa tui ;,crije02.croala292491.croala-lat2w:body.div4.div6.l46.w4,,,,,,,,,,,,,,,,,,,,,,
estlocusX,Nais,"Herculeum auderes tangere , Nais , Hylan ,",crije02.croala292491.croala-lat2w:body.div4.div11.l30.w4,,,,,,,,,,,,,,,,,,,,,,
estlocusX,Naronaeis,Terra Naronaeis proxima cingor aquis .,crije02.croala292491.croala-lat2w:body.div1.div20.l2.w2,,,,,,,,,,,,,,,,,,,,,,
estlocusX,Nembrotia,"Nec damnata fuit , quando Nembrotia turris",crije02.croala292491.croala-lat2w:body.div2.div2.l126.w5,,,,,,,,,,,,,,,,,,,,,,
estlocusX,Nemesis,Non tulit hoc Nemesis ; nam rostro atque unguibus uncis,crije02.croala292491.croala-lat2w:body.div6.div32.l27.w4,,,,,,,,,,,,,,,,,,,,,,
estlocusX,Neptunia,Temperat et lusu Neptunia monstra proteruo ;,crije02.croala292491.croala-lat2w:body.div1.div4.l49.w4,,,,,,,,,,,,,,,,,,,,,,
estlocusX,Nestorei,Hernia Nestorei seu ramicis hyrta moratur,crije02.croala292491.croala-lat2w:body.div2.div7.l44.w2,,,,,,,,,,,,,,,,,,,,,,
estlocusX,Nestoreos,Sic te Nestoreos dare laurea serta per annos,crije02.croala292491.croala-lat2w:body.div6.div3.l241.w3,,,,,,,,,,,,,,,,,,,,,,
estlocusX,Nilus,Delendisque fluet Nilus ubique notis ;,crije02.croala292491.croala-lat2w:body.div1.div3.l88.w3,,,,,,,,,,,,,,,,,,,,,,
estlocusX,Nil,Nil datur ex tanto praeter simulacra decore .,crije02.croala292491.croala-lat2w:body.div2.div4.l111.w1,,,,,,,,,,,,,,,,,,,,,,
estlocusX,Nil,Nil desiderio dignum te praeter et extra,crije02.croala292491.croala-lat2w:body.div2.div4.l141.w1,,,,,,,,,,,,,,,,,,,,,,
estlocusX,Nil,"Nil superest uirtute pari , nam manca uel impar",crije02.croala292491.croala-lat2w:body.div2.div4.l252.w1,,,,,,,,,,,,,,,,,,,,,,
estlocusX,Nil,Nil tectis uulgare tuis : conuiuia sunt haec,crije02.croala292491.croala-lat2w:body.div3.div16.l9.w1,,,,,,,,,,,,,,,,,,,,,,
estlocusX,Nil,Nil sero iuuat ! Ergo quid moramur ?,crije02.croala292491.croala-lat2w:body.div3.div29.l62.w1,,,,,,,,,,,,,,,,,,,,,,
estlocusX,Nilo,Danubio aut Nilo non uilior Ombla fuisset,crije02.croala292491.croala-lat2w:body.div4.div11.l35.w3,,,,,,,,,,,,,,,,,,,,,,
estlocusX,Nil,"Nil metuens casus , praeceps cuicumque uocanti",crije02.croala292491.croala-lat2w:body.div5.div4.l403.w1,,,,,,,,,,,,,,,,,,,,,,
estlocusX,Nil,"Nil profectura sic Virbius arte reuixit ,",crije02.croala292491.croala-lat2w:body.div6.div1.l57.w1,,,,,,,,,,,,,,,,,,,,,,
estlocusX,Nilumque,Quod Tanaim Nilumque interiacet atque Britannos,crije02.croala292491.croala-lat2w:body.div6.div3.l171.w3,,,,,,,,,,,,,,,,,,,,,,
estlocusX,Nili,"Quas septemgemini fluenta Nili ,",crije02.croala292491.croala-lat2w:body.div7.div5.l16.w4,,,,,,,,,,,,,,,,,,,,,,
estlocusX,Notaque,"Notaque lustremus passim uestigia , sanctum",crije02.croala292491.croala-lat2w:body.div1.div1.l271.w1,,,,,,,,,,,,,,,,,,,,,,
estlocusX,Nothum,Sic patimur Choros horribilemque Nothum,crije02.croala292491.croala-lat2w:body.div4.div11.l38.w5,,,,,,,,,,,,,,,,,,,,,,
estlocusX,Notus,Notus in caelo angelus et Geennae,crije02.croala292491.croala-lat2w:body.div7.div8.l17.w1,,,,,,,,,,,,,,,,,,,,,,
estlocusX,Nyctiliumque,Menaliumque colat Nyctiliumque patrem ;,crije02.croala292491.croala-lat2w:body.div4.div12.l48.w3,,,,,,,,,,,,,,,,,,,,,,
estlocusX,Nysaeis,"Cum sua Nysaeis praetexuit arma corymbis ,",crije02.croala292491.croala-lat2w:body.div5.div4.l235.w3,,,,,,,,,,,,,,,,,,,,,,
estlocusX,Nysa,Tigres et insolitos miratur Nysa iugales,crije02.croala292491.croala-lat2w:body.div5.div4.l240.w5,,,,,,,,,,,,,,,,,,,,,,
estlocusX,Oaxis,"Aethereumque dabit numen Oaxis aquae ,",crije02.croala292491.croala-lat2w:body.div1.div3.l86.w4,,,,,,,,,,,,,,,,,,,,,,
estlocusX,Occasus,"Ortus et Occasus , totus et orbis erunt .",crije02.croala292491.croala-lat2w:body.div1.div3.l100.w3,,,,,,,,,,,,,,,,,,,,,,
estlocusX,Occasus,"Occasus ortusque uident , uno agmine et omnes",crije02.croala292491.croala-lat2w:body.div5.div4.l94.w1,,,,,,,,,,,,,,,,,,,,,,
estlocusX,Occasus,"Arctos et Occasus corpus conspiret in unum ,",crije02.croala292491.croala-lat2w:body.div7.div20.l119.w3,,,,,,,,,,,,,,,,,,,,,,
estlocusX,Occeanum,Pestis et extremum gliscet in Occeanum .,crije02.croala292491.croala-lat2w:body.div1.div5.l90.w6,,,,,,,,,,,,,,,,,,,,,,
estlocusX,Occeani,Occeani refluis erutus horror aquis .,crije02.croala292491.croala-lat2w:body.div1.div5.l98.w1,,,,,,,,,,,,,,,,,,,,,,
estlocusX,Occeano,Occeano qui per dispendia crescit et omnes,crije02.croala292491.croala-lat2w:body.div2.div4.l147.w1,,,,,,,,,,,,,,,,,,,,,,
estlocusX,Occeano,Occeano pestis ; superat tua copia tantos,crije02.croala292491.croala-lat2w:body.div2.div4.l165.w1,,,,,,,,,,,,,,,,,,,,,,
estlocusX,Occeanus," Occeanus felix , cinnama mittit Arabs .",crije02.croala292491.croala-lat2w:body.div3.div1.l70.w1,,,,,,,,,,,,,,,,,,,,,,
estlocusX,Occeani,"Occeani , quicquid fesso Titane rubescit .",crije02.croala292491.croala-lat2w:body.div5.div2.l58.w1,,,,,,,,,,,,,,,,,,,,,,
estlocusX,Occeanum,Alter in Occeanum Solisque cubilia regnat .,crije02.croala292491.croala-lat2w:body.div5.div2.l77.w3,,,,,,,,,,,,,,,,,,,,,,
estlocusX,Occeanus,"Nec fuit Occeanus , picte Britanne , tuus ,",crije02.croala292491.croala-lat2w:body.div6.div3.l174.w3,,,,,,,,,,,,,,,,,,,,,,
estlocusX,Occeani,Et monstra Occeani reciprocantis,crije02.croala292491.croala-lat2w:body.div6.div6.l3.w3,,,,,,,,,,,,,,,,,,,,,,
estlocusX,Occeanique,"Occeanique aperit commercia , et orbibus orbes",crije02.croala292491.croala-lat2w:body.div6.div29.l21.w1,,,,,,,,,,,,,,,,,,,,,,
estlocusX,Oebalio,"Quae luxu Oebalio desidiosa fluis ,",crije02.croala292491.croala-lat2w:body.div3.div21.l92.w3,,,,,,,,,,,,,,,,,,,,,,
estlocusX,Oebosia,Et canna Oebosia coit .,crije02.croala292491.croala-lat2w:body.div4.div15.l12.w3,,,,,,,,,,,,,,,,,,,,,,
estlocusX,Oedipodionio,"Oedipodionio , terra , furore nocens ,",crije02.croala292491.croala-lat2w:body.div6.div3.l266.w1,,,,,,,,,,,,,,,,,,,,,,
estlocusX,Ogygios,"Auguror Ogygios indoluisse lares ,",crije02.croala292491.croala-lat2w:body.div6.div3.l284.w2,,,,,,,,,,,,,,,,,,,,,,
estlocusX,Oleniae," Non tamen Oleniae foedamur ab imbre capellae ,",crije02.croala292491.croala-lat2w:body.div3.div1.l21.w3,,,,,,,,,,,,,,,,,,,,,,
estlocusX,Oleniae,Signa nec Oleniae pluuiali nube capellae,crije02.croala292491.croala-lat2w:body.div5.div4.l123.w3,,,,,,,,,,,,,,,,,,,,,,
estlocusX,Ombula,"Ombula frigidulo mulcet amoena sinu ,",crije02.croala292491.croala-lat2w:body.div4.div11.l4.w1,,,,,,,,,,,,,,,,,,,,,,
estlocusX,Ombla,Danubio aut Nilo non uilior Ombla fuisset,crije02.croala292491.croala-lat2w:body.div4.div11.l35.w6,,,,,,,,,,,,,,,,,,,,,,
estlocusX,Orchades,Orchades atque alio porrecta Britannia mundo,crije02.croala292491.croala-lat2w:body.div5.div2.l65.w1,,,,,,,,,,,,,,,,,,,,,,
estlocusX,Orcus,"Te , lucemque tuam tremit Orcus et intima Ditis",crije02.croala292491.croala-lat2w:body.div1.div1.l159.w5,,,,,,,,,,,,,,,,,,,,,,
estlocusX,Orci,"Adsertos ciues , detractum et faucibus Orci",crije02.croala292491.croala-lat2w:body.div2.div2.l30.w6,,,,,,,,,,,,,,,,,,,,,,
estlocusX,Orcus,"Totque relaxatos reddidit Orcus auos ,",crije02.croala292491.croala-lat2w:body.div7.div13.l32.w4,,,,,,,,,,,,,,,,,,,,,,
estlocusX,Orci,"Trucis Orci , amica uerum",crije02.croala292491.croala-lat2w:body.div7.div31.l34.w2,,,,,,,,,,,,,,,,,,,,,,
estlocusX,Oriens,"Non , Oriens , ultra bacchabere ; regia Ditis",crije02.croala292491.croala-lat2w:body.div7.div26.l35.w2,,,,,,,,,,,,,,,,,,,,,,
estlocusX,Orione,Ensifero nec si quatietur Orione caelum,crije02.croala292491.croala-lat2w:body.div4.div4.l91.w5,,,,,,,,,,,,,,,,,,,,,,
estlocusX,Orion,"Axe tulit taelisque suis armauit Orion ,",crije02.croala292491.croala-lat2w:body.div5.div4.l19.w6,,,,,,,,,,,,,,,,,,,,,,
estlocusX,Orthonam,"Orthonam hanc perhibent . Cupiunt tamen , inclyte Princeps ,",crije02.croala292491.croala-lat2w:body.div1.div6.l21.w1,,,,,,,,,,,,,,,,,,,,,,
estlocusX,Ortu,Ortu integrescunt aurea saecla Tuo .,crije02.croala292491.croala-lat2w:body.div1.div1.l152.w1,,,,,,,,,,,,,,,,,,,,,,
estlocusX,Ortus,"Ortus et Occasus , totus et orbis erunt .",crije02.croala292491.croala-lat2w:body.div1.div3.l100.w1,,,,,,,,,,,,,,,,,,,,,,
estlocusX,Ortus,Ortus et occasus coalescet corpus in unum,crije02.croala292491.croala-lat2w:body.div5.div2.l119.w1,,,,,,,,,,,,,,,,,,,,,,
estlocusX,Ossae,"Non uallum , non castra queant . Tu Pelion Ossae",crije02.croala292491.croala-lat2w:body.div5.div4.l448.w8,,,,,,,,,,,,,,,,,,,,,,
estlocusX,Pactolus,"Hermus et exundat rutilis Pactolus harenis ,",crije02.croala292491.croala-lat2w:body.div5.div4.l239.w5,,,,,,,,,,,,,,,,,,,,,,
estlocusX,Padi,"Dux , Phaethontaei gloria magna Padi ,",crije02.croala292491.croala-lat2w:body.div3.div8.l20.w5,,,,,,,,,,,,,,,,,,,,,,
estlocusX,Padusae,"Moestaque lugubris creuerunt stagna Padusae ,",crije02.croala292491.croala-lat2w:body.div3.div11.l13.w5,,,,,,,,,,,,,,,,,,,,,,
estlocusX,Palestinae,Perque Palestinae saltus regionis habundet,crije02.croala292491.croala-lat2w:body.div1.div1.l279.w2,,,,,,,,,,,,,,,,,,,,,,
estlocusX,Palestinis,Esse Palestinis aemula parque iugis,crije02.croala292491.croala-lat2w:body.div6.div31.l6.w2,,,,,,,,,,,,,,,,,,,,,,
estlocusX,Pangaea,"Turca uel horribilis , quem nunc Pangaea uerentur",crije02.croala292491.croala-lat2w:body.div6.div2.l61.w6,,,,,,,,,,,,,,,,,,,,,,
estlocusX,Pangaea,"Heu , quantam cladem Rodope et Pangaea minantur ,",crije02.croala292491.croala-lat2w:body.div7.div20.l103.w6,,,,,,,,,,,,,,,,,,,,,,
estlocusX,Pangaea,"Horrescunt Pangaea , pauent Rodopeia saxa ,",crije02.croala292491.croala-lat2w:body.div7.div26.l37.w2,,,,,,,,,,,,,,,,,,,,,,
estlocusX,Pannonia,"Te solum mea Musa ducem et Pannonia nacta est ,",crije02.croala292491.croala-lat2w:body.div1.div2.l19.w7,,,,,,,,,,,,,,,,,,,,,,
estlocusX,Pannonis,Suspiretque suos Pannonis ora duces .,crije02.croala292491.croala-lat2w:body.div1.div2.l66.w3,,,,,,,,,,,,,,,,,,,,,,
estlocusX,Pannoniae,"Pannoniae fines tribuit commune sepulcrum ,",crije02.croala292491.croala-lat2w:body.div1.div2.l97.w1,,,,,,,,,,,,,,,,,,,,,,
estlocusX,Pannonicis,"Caetera Pannonicis prostrata cadauera campis ,",crije02.croala292491.croala-lat2w:body.div1.div2.l103.w2,,,,,,,,,,,,,,,,,,,,,,
